[
   {
      "image" : "http://static.giantbomb.com/uploads/original/0/30/2705712-2014-12-01+15.20.32.jpg",
      "media_link" : "http://www.giantbomb.com/podcasts/download/1084/Giant_Bombcast_12_02_14-12-02-2014-3170366765.mp3",
      "id" : 438,
      "description" : "The holidays are almost upon us, and we're cramming every last person we can into this podcast just for you! The entire current Giant Bomb staff is here to discuss the games of the day, the perils of home ownership, why you'd want a mortgage, living in ge",
      "link" : "http://www.giantbomb.com/podcasts/giant-bombcast-12-02-2014/1600-1084/",
      "published_at" : "2014-12-02T23:25:00.000Z",
      "external_id" : 1084,
      "title" : "Giant Bombcast 12/02/2014"
   },
   {
      "image" : "http://static.giantbomb.com/uploads/original/0/30/2703826-surge.png",
      "media_link" : "http://www.giantbomb.com/podcasts/download/1079/Giant_Bombcast_11_25_2014-11-25-2014-4554469778.mp3",
      "id" : 439,
      "description" : "We're reconvening the drink council for a very important test before moving on to the regular business of, uh, talking about whatever. There's a new Geometry Wars! Master Chief Collection is still broken! Smash Bros. came out! Little girls hate Quick Look",
      "title" : "Giant Bombcast 11/25/2014",
      "external_id" : 1079,
      "published_at" : "2014-11-25T20:45:00.000Z",
      "link" : "http://www.giantbomb.com/podcasts/giant-bombcast-11-25-2014/1600-1079/"
   },
   {
      "description" : "Rorie substitutes in for Drew to chat about the latest Age of Dragons before we move on to kneecap last week's shoddy releases. There's no talking in the library, but plenty of talk about Far Cry 4, the new GTA V, Corbin Bernsen's directing career, PlaySt",
      "media_link" : "http://www.giantbomb.com/podcasts/download/1074/Giant_Bombcast_11_18_2014-11-18-2014-5802221670.mp3",
      "id" : 440,
      "title" : "Giant Bombcast 11/18/2014",
      "published_at" : "2014-11-18T22:30:00.000Z",
      "external_id" : 1074,
      "link" : "http://www.giantbomb.com/podcasts/giant-bombcast-11-18-2014/1600-1074/",
      "image" : "http://static.giantbomb.com/uploads/original/0/30/2702057-untitled.png"
   },
   {
      "id" : 441,
      "media_link" : "http://www.giantbomb.com/podcasts/download/1065/Giant_Bombcast_11_11_2014-11-11-2014-7871643993.mp3",
      "description" : "The fourth quarter is HEATING UP, and Giant Bomb Action News is on the scene to report on Assassin's Creed: Unity, the Master Chief Collection, \"new\" Blizzard games, the Mario Stack Rank, the return of one Mr. Hawk, and the true identity of the rap game K",
      "title" : "Giant Bombcast 11/11/2014",
      "published_at" : "2014-11-11T19:30:00.000Z",
      "external_id" : 1065,
      "link" : "http://www.giantbomb.com/podcasts/giant-bombcast-11-11-2014/1600-1065/",
      "image" : "http://static.giantbomb.com/uploads/original/0/30/2699945-asdfasdf.png"
   },
   {
      "title" : "Giant Bombcast 11/04/2014",
      "link" : "http://www.giantbomb.com/podcasts/giant-bombcast-11-04-2014/1600-1057/",
      "external_id" : 1057,
      "published_at" : "2014-11-04T23:30:00.000Z",
      "description" : "Dan's back from his Kansas City odyssey to regale us with tales of... well, you'll see, plus the annual Call of Duty check-in, Freddie Mercury's Sunset Overdrive, the true value of Donkey Kong Country, Dennis Dyack's re-return, the latest Canseco mishap,",
      "media_link" : "http://www.giantbomb.com/podcasts/download/1057/Giant_Bombcast_11_04_2014-11-04-2014-1117749203.mp3",
      "id" : 442,
      "image" : "http://static.giantbomb.com/uploads/original/0/30/2698331-asdfasdf.jpg"
   },
   {
      "image" : "http://static.giantbomb.com/uploads/original/0/30/2696664-screen-shot-2014-10-28-at-6.03.55-pmb.jpg",
      "description" : "We're fresh (?!) off of Extra Life to recap strategies for stayin' up all night, Drew's globetrotting adventures, more on Sunset Overdrive, the not-very-mysterious identity of Quartermann, Xbox price drops, and the gastric processes of vampires.",
      "media_link" : "http://www.giantbomb.com/podcasts/download/1048/Giant_Bombcast_10_28_2014-10-28-2014-3292317790.mp3",
      "id" : 443,
      "link" : "http://www.giantbomb.com/podcasts/giant-bombcast-10-28-2014/1600-1048/",
      "published_at" : "2014-10-29T02:00:00.000Z",
      "external_id" : 1048,
      "title" : "Giant Bombcast 10/28/2014"
   },
   {
      "image" : "http://static.giantbomb.com/uploads/original/0/30/2694231-untitled.png",
      "media_link" : "http://www.giantbomb.com/podcasts/download/1041/Giant_Bombcast_10_21_2014-10-21-2014-6509205671.mp3",
      "id" : 444,
      "description" : "With Drew wrapping up his odyssey on the other side of the world, Jason's back to keep the podcast party going with more on Bayonetta 2, Sunset Overdrive, Borderlands: The Pre-Sequel, Killer Instinct Season 2, Axl Rose's favorite pinball phrases, some byg",
      "title" : "Giant Bombcast 10/21/2014",
      "link" : "http://www.giantbomb.com/podcasts/giant-bombcast-10-21-2014/1600-1041/",
      "external_id" : 1041,
      "published_at" : "2014-10-21T22:30:00.000Z"
   },
   {
      "image" : "http://static.giantbomb.com/uploads/original/0/30/2691621-peanuts_full.jpg",
      "id" : 445,
      "description" : "With the Destiny raid completed, we sit back and, um, chat about the Destiny raid... Wait, come back! Jason A. Striker joins us to talk Bayonetta 2, The Evil Within, Borderlands: The Pre-Sequel, the new New 3DS, more on AC: Unity resolutions, nice bounty",
      "media_link" : "http://www.giantbomb.com/podcasts/download/1034/Giant_Bombcast_10_14_2014-10-14-2014-1451096026.mp3",
      "title" : "Giant Bombcast 10/14/2014",
      "link" : "http://www.giantbomb.com/podcasts/giant-bombcast-10-14-2014/1600-1034/",
      "published_at" : "2014-10-15T01:30:00.000Z",
      "external_id" : 1034
   },
   {
      "description" : "We're back from Black Rock City with all the latest on art cars, sex tents, desert drugs, and video games! Matthew \"Matt\" Rorie joins us to chat Driveclub, Alien: Isolation, even more on the Destiny endgame, beaver butts, the 900th P, and Dan Ryckert's fe",
      "media_link" : "http://www.giantbomb.com/podcasts/download/1027/Giant_Bombcast_10_07_2014-10-07-2014-3560232576.mp3",
      "id" : 446,
      "published_at" : "2014-10-08T02:00:00.000Z",
      "external_id" : 1027,
      "link" : "http://www.giantbomb.com/podcasts/giant-bombcast-10-07-2014/1600-1027/",
      "title" : "Giant Bombcast 10/07/2014",
      "image" : "http://static.giantbomb.com/uploads/original/0/30/2689614-burning-man-festival-2013.jpg"
   },
   {
      "media_link" : "http://www.giantbomb.com/podcasts/download/1021/Giant_Bombcast_09_30_2014-09-30-2014-0242176111.mp3",
      "id" : 447,
      "description" : "Quarter four is upon us and it's all games all the time around here, with in-depth chattin' about Shadow of Mordor, Forza Horizon 2, Super Smash Bros. 3DS, and Gauntlet. Well, fine, you can also hang around for our favorite hangover avoidance strategies.",
      "title" : "Giant Bombcast 09/30/2014",
      "link" : "http://www.giantbomb.com/podcasts/giant-bombcast-09-30-2014/1600-1021/",
      "external_id" : 1021,
      "published_at" : "2014-10-01T00:30:00.000Z",
      "image" : "http://static.giantbomb.com/uploads/original/0/30/2687424-asdf.jpg"
   },
   {
      "link" : "http://www.giantbomb.com/podcasts/giant-bombcast-09-23-2014/1600-1013/",
      "external_id" : 1013,
      "published_at" : "2014-09-24T00:15:00.000Z",
      "title" : "Giant Bombcast 09/23/2014",
      "media_link" : "http://www.giantbomb.com/podcasts/download/1013/Giant_Bombcast_09_23_2014-09-23-2014-6886492276.mp3",
      "id" : 448,
      "description" : "It's an Irish invasion as GameSpot's Danny O'Dwyer joins us to talk about the right way to enjoy Destiny, the wrong way to parse English accents, whatever the hell Final Fantasy is now, and the perils of programming video games. It has been two (2) weeks",
      "image" : "http://static.giantbomb.com/uploads/original/0/30/2685556-mc3-1024x768.jpg"
   },
   {
      "image" : "http://static.giantbomb.com/uploads/original/0/30/2683395-fall+and+winter+2011+030.jpg",
      "link" : "http://www.giantbomb.com/podcasts/giant-bombcast-09-16-2014/1600-1006/",
      "external_id" : 1006,
      "published_at" : "2014-09-16T22:00:00.000Z",
      "title" : "Giant Bombcast 09/16/2014",
      "description" : "Destiny still rules the video game talk around these parts... but then, who just listens to this podcast for games? Especially when you can also hear about hot topics like dying on Mars, drinking on battleships, the John Carmack Tweet of the Week, and TWO",
      "id" : 449,
      "media_link" : "http://www.giantbomb.com/podcasts/download/1006/Giant_Bombcast_09_16_2014-09-16-2014-4547615993.mp3"
   },
   {
      "id" : 450,
      "media_link" : "http://www.giantbomb.com/podcasts/download/996/Giant_Bombcast_09_09_2014-09-09-2014-2471478547.mp3",
      "description" : "Destiny is here and it's time to talk about it. Once we've gone over our first few hours with Bungie's latest, stick around for further discussion of Drew's introduction to local wrestling, Dan's recipe for bathtub chicken, and the popularity of Giant Bom",
      "external_id" : 996,
      "published_at" : "2014-09-10T02:00:00.000Z",
      "link" : "http://www.giantbomb.com/podcasts/giant-bombcast-09-09-2014/1600-996/",
      "title" : "Giant Bombcast 09/09/2014",
      "image" : "http://static.giantbomb.com/uploads/original/0/30/2681192-10446492_718539621516396_982544460160723806_n.jpg"
   },
   {
      "title" : "Giant Bombcast 09/02/2014",
      "published_at" : "2014-09-03T02:00:00.000Z",
      "external_id" : 985,
      "link" : "http://www.giantbomb.com/podcasts/giant-bombcast-09-02-2014/1600-985/",
      "description" : "Join us as we mop up the last little bit of PAX Prime business before moving on to more pressing discussions about eating bugs, Sony's TGS news, Frasier Pinball, the marvels of food science, and how to survive the apocalypse.",
      "media_link" : "http://www.giantbomb.com/podcasts/download/985/Giant_Bombcast_09_02_2014-09-02-2014-0421006970.mp3",
      "id" : 451,
      "image" : "http://static.giantbomb.com/uploads/original/0/30/2677896-chicken_nuggets_-_10pc.jpg"
   },
   {
      "image" : "http://static.giantbomb.com/uploads/original/0/30/2674982-7168319663_2a37290f1c.jpg",
      "title" : "Giant Bombcast 08/26/2014",
      "link" : "http://www.giantbomb.com/podcasts/giant-bombcast-08-26-2014/1600-982/",
      "external_id" : 982,
      "published_at" : "2014-08-27T02:00:00.000Z",
      "description" : "Not even the earth shaking beneath our feet can stop us from talking about bad Mario Kart tournaments, Infamous: First Light, the feasibility of Star Citizen, the Amazon/Twitch deal, Smash Bros. leaks, and another of Dan's awful, awful stories.",
      "id" : 452,
      "media_link" : "http://www.giantbomb.com/podcasts/download/982/Giant_Bombcast_08_26_2014-08-26-2014-4550906413.mp3"
   },
   {
      "description" : "With Dan out at SummerSlam, Matt Rorie joins us to... have a lengthy conversation about professional wrestling, not to mention discussions of platform exclusivity, the Gamescom meat grinder, John Romero's return to shooters, and how to protect your virtua",
      "id" : 453,
      "media_link" : "http://www.giantbomb.com/podcasts/download/974/Giant_Bombcast_08_19_2014-08-19-2014-0165639036.mp3",
      "title" : "Giant Bombcast 08/19/2014",
      "link" : "http://www.giantbomb.com/podcasts/giant-bombcast-08-19-2014/1600-974/",
      "external_id" : 974,
      "published_at" : "2014-08-19T21:30:00.000Z",
      "image" : "http://static.giantbomb.com/uploads/original/0/30/2672326-asdf.jpg"
   },
   {
      "image" : "http://static.giantbomb.com/uploads/original/0/30/2669660-098.jpg",
      "id" : 454,
      "description" : "Jeff is back in the office...just long enough to tell us about his budding career as a pro Blitzball player. Brad played games other than Dota. Drew did battle in Golden Gate Park. Dan's been hanging out with the riff raff again. All this, plus your scari",
      "media_link" : "http://www.giantbomb.com/podcasts/download/965/Giant_Bombcast_08_12_2014-08-12-2014-4971499083.mp3",
      "link" : "http://www.giantbomb.com/podcasts/giant-bombcast-08-12-2014/1600-965/",
      "published_at" : "2014-08-13T01:00:00.000Z",
      "external_id" : 965,
      "title" : "Giant Bombcast 08/12/2014"
   },
   {
      "description" : "Newly minted Sony company man John T. Drake has completed his cross-country trek just in time to discuss the mystery of Matt Kessler, the riddle of Dan Ryckert, the curse of historic Barkerville, and the dilemma of Dwayne Johnson.",
      "id" : 455,
      "media_link" : "http://www.giantbomb.com/podcasts/download/957/Giant_Bombcast_08_05_2014-08-05-2014-7068316248.mp3",
      "link" : "http://www.giantbomb.com/podcasts/giant-bombcast-08-05-2014/1600-957/",
      "published_at" : "2014-08-06T01:00:00.000Z",
      "external_id" : 957,
      "title" : "Giant Bombcast 08/05/2014",
      "image" : "http://static.giantbomb.com/uploads/original/0/30/2666961-untitled.jpg"
   },
   {
      "image" : "http://static.giantbomb.com/uploads/original/0/30/2663897-5fbc76031a6e4a4287689794f5af8d17170af99e0180ed53d9c9ee70ae9592e6.jpg",
      "description" : "We're live from the great state of Silicon Valley, USA with a hot list of summer tips to keep your water usage cool and conservational! Then you can beat the heat with the latest on Firefall, Destiny, Velvet Sundown, The Last of Us Remastered, and the end",
      "id" : 456,
      "media_link" : "http://www.giantbomb.com/podcasts/download/949/Giant_Bombcast_07_29_2014-07-29-2014-4264559189.mp3",
      "title" : "Giant Bombcast 07/29/2014",
      "link" : "http://www.giantbomb.com/podcasts/giant-bombcast-07-29-2014/1600-949/",
      "published_at" : "2014-07-29T22:30:00.000Z",
      "external_id" : 949
   },
   {
      "media_link" : "http://www.giantbomb.com/podcasts/download/941/Giant_Bombcast_07_22_2014-07-22-2014-0609144494.mp3",
      "description" : "Brad's fresh off a plane from The International 4 to talk about rare couriers! Oh, and also Dota 2. Drew is a Ghostship Snowpiercer. Jeff plays too much bingo. Dan Ryckert doesn't know how to cook. Plus your incredible edible emails!",
      "id" : 457,
      "title" : "Giant Bombcast 07/22/2014",
      "link" : "http://www.giantbomb.com/podcasts/giant-bombcast-07-22-2014/1600-941/",
      "published_at" : "2014-07-23T05:00:00.000Z",
      "external_id" : 941,
      "image" : "http://static.giantbomb.com/uploads/original/0/30/2661135-img_1483.jpg"
   },
   {
      "id" : 458,
      "description" : "Sentris developer Samantha Kalman drops by to chat with us about GaymerX2, the value of programming, the Nintendo 64's forgotten lineup, electronic sports, the secret identity of Freezyfrog, microbial science, and Dan Ryckert's odd, odd palate.",
      "media_link" : "http://www.giantbomb.com/podcasts/download/924/Giant_Bombcast_07_15_2014-07-15-2014-4731535869.mp3",
      "title" : "Giant Bombcast 07/15/2014",
      "external_id" : 924,
      "published_at" : "2014-07-16T00:45:00.000Z",
      "link" : "http://www.giantbomb.com/podcasts/giant-bombcast-07-15-2014/1600-924/",
      "image" : "http://static.giantbomb.com/uploads/original/0/30/2657957-e_coli.jpg"
   },
   {
      "image" : "http://static.giantbomb.com/uploads/original/0/26/2655042-4374258116-Olymp.jpg",
      "description" : "July rages on with discussion of important games like horseshoes. Also we discuss Cliff Blezinski's new operation, Gearbox's new hobby-grade meta-growth video gaming product, Destiny's ninety different versions, Mighty No. 9's hat-passing techniques, and",
      "id" : 459,
      "media_link" : "http://www.giantbomb.com/podcasts/download/918/Giant_Bombcast_07_08_2014-07-08-2014-5812425322.mp3",
      "external_id" : 918,
      "published_at" : "2014-07-09T02:49:00.000Z",
      "link" : "http://www.giantbomb.com/podcasts/giant-bombcast-07-08-2014/1600-918/",
      "title" : "Giant Bombcast 07/08/2014"
   },
   {
      "image" : "http://static.giantbomb.com/uploads/original/0/26/2651627-img_1476.jpg",
      "description" : "Brad returns from vacation to discuss his handheld travel adventures while Jeff and Drew wax poetic about the news of the week, shooting Nazis in their privates, buying Japanese PSN games, and your emails. This week: Why can't Jeff stop playing Marvel Her",
      "id" : 460,
      "media_link" : "http://www.giantbomb.com/podcasts/download/915/Giant_Bombcast_07_01_2014-06-30-2014-4049796443.mp3",
      "published_at" : "2014-07-01T02:11:00.000Z",
      "external_id" : 915,
      "link" : "http://www.giantbomb.com/podcasts/giant-bombcast-07-01-2014/1600-915/",
      "title" : "Giant Bombcast 07/01/2014"
   },
   {
      "image" : "http://static.giantbomb.com/uploads/original/0/26/2649599-6001335744-17iqo.jpg",
      "description" : "Drew and Jeff are joined by a pair of guests as we discuss table flipping arcade games, the mysterious appearance of Vince, EA's UFC, Primal Rage 2, floppy disk versions of Strider, and \"football.\"",
      "id" : 461,
      "media_link" : "http://www.giantbomb.com/podcasts/download/905/Giant_Bombcast_06_24_2014-06-24-2014-0291598917.mp3",
      "title" : "Giant Bombcast 06/24/2014",
      "published_at" : "2014-06-24T22:51:00.000Z",
      "external_id" : 905,
      "link" : "http://www.giantbomb.com/podcasts/giant-bombcast-06-24-2014/1600-905/"
   },
   {
      "description" : "E3 2014 has come and gone, and we're left to pick up the pieces with further ruminations on No Man's Sky, Battlefield Hardline, Far Cry 4, and Destiny, along with Drew's weekend combat experience, Danny's Irish plague, Rorie's E3 at home, and the one emai",
      "id" : 462,
      "media_link" : "http://www.giantbomb.com/podcasts/download/900/Giant_Bombcast_06_17_2014-06-17-2014-2230621314.mp3",
      "title" : "Giant Bombcast 06/17/2014",
      "link" : "http://www.giantbomb.com/podcasts/giant-bombcast-06-17-2014/1600-900/",
      "published_at" : "2014-06-18T02:30:00.000Z",
      "external_id" : 900,
      "image" : "http://static.giantbomb.com/uploads/original/0/30/2647290-staring_contest.svg.png"
   },
   {
      "description" : "We close out the show with our impressions and a lineup of guests that includes Ed Boon, Zoe Quinn, Geoff Keighley, Alexa Ray Corriea, Josh Sawyer, Abbie Heppe, Rami Ismail, Paul Barnett, and more!",
      "media_link" : "http://www.giantbomb.com/podcasts/download/896/E3_2014_Day_3-06-13-2014-6622666530.mp3",
      "id" : 463,
      "link" : "http://www.giantbomb.com/podcasts/e3-2014-day-three-live/1600-896/",
      "published_at" : "2014-06-13T21:48:00.000Z",
      "external_id" : 896,
      "title" : "E3 2014: Day Three LIVE!",
      "image" : "http://static.giantbomb.com/uploads/original/0/26/2645582-screen+shot+2014-06-13+at+1.30.43+pm.png"
   },
   {
      "image" : "http://static.giantbomb.com/uploads/original/0/26/2645107-tumblr_n71loftlko1taj4kwo1_1280.jpg",
      "link" : "http://www.giantbomb.com/podcasts/e3-2014-day-two-live/1600-894/",
      "published_at" : "2014-06-12T21:39:00.000Z",
      "external_id" : 894,
      "title" : "E3 2014: Day Two LIVE!",
      "description" : "We're joined by Some Brothers McElroy, Cara Ellison, Casey Lynch, Mikey Neumann, Beef O'Brady, Seth Killian, Wes Phillips, Jeremy Hoffman, Chris Charla, Mike Mika, Dennis Wedin, Nathan Vella, Kris Piotrowski, Greg Rice, Rayme Vinson, Abbie Heppe, and more",
      "id" : 464,
      "media_link" : "http://www.giantbomb.com/podcasts/download/894/E3_2014_Day_2-06-12-2014-4351225992.mp3"
   },
   {
      "image" : "http://static.giantbomb.com/uploads/original/0/26/2644453-screen+shot+2014-06-11+at+12.29.48+pm.png",
      "link" : "http://www.giantbomb.com/podcasts/e3-2014-day-one-live/1600-892/",
      "external_id" : 892,
      "published_at" : "2014-06-11T20:39:00.000Z",
      "title" : "E3 2014: Day One LIVE!",
      "media_link" : "http://www.giantbomb.com/podcasts/download/892/E3_2014_Day_1-06-11-2014-5347121814.mp3",
      "description" : "We're joined by Palmer Luckey, Shuhei Yoshida, Phil Spencer, Dave Lang, Adam Boyes, Greg Kasavin, Sean Murray, John Mamais, and a host of additional luminaries as our first day of E3 2014 wraps up!",
      "id" : 465
   },
   {
      "image" : "http://static.giantbomb.com/uploads/original/0/96/1522989-trico19.jpg",
      "title" : "Giant Bombcast 06/10/2014: E3 Preview and Predictions!",
      "external_id" : 888,
      "published_at" : "2014-06-10T20:00:00.000Z",
      "link" : "http://www.giantbomb.com/podcasts/giant-bombcast-06-10-2014-e3-preview-and-predictio/1600-888/",
      "media_link" : "http://www.giantbomb.com/podcasts/download/888/Video_Games_Giant_Bombcast_06_10_2014-06-10-2014-4185635559.mp3",
      "description" : "We gather together the week before E3 to cover the games Jeff saw during his pre-show sojourn and make a bunch of very half-cocked predictions. Listen in to see just how wrong we were!",
      "id" : 466
   },
   {
      "title" : "E3 2014: Day Zero Wrap-Up!",
      "external_id" : 890,
      "published_at" : "2014-06-10T16:44:00.000Z",
      "link" : "http://www.giantbomb.com/podcasts/e3-2014-day-zero-wrap-up/1600-890/",
      "description" : "The press conferences are over and we're wrapping up with friends from 8-4, Harmonix, and more!",
      "media_link" : "http://www.giantbomb.com/podcasts/download/890/E3_2014_Day_0_%28Premium%29-06-10-2014-1469170785.mp3",
      "id" : 467,
      "image" : "http://static.giantbomb.com/uploads/original/0/26/2643688-8266185548-tumbl.png"
   },
   {
      "image" : "http://static.giantbomb.com/uploads/original/0/26/2640259-0026158287-zardo.jpg",
      "link" : "http://www.giantbomb.com/podcasts/giant-bombcast-06-03-2014/1600-882/",
      "external_id" : 882,
      "published_at" : "2014-06-04T01:59:00.000Z",
      "title" : "Giant Bombcast 06/03/2014",
      "description" : "It's the week before E3 and we're just going to shout \"Pushmo World\" over and over again. OK, well, maybe we'll talk a bit about Batman: Arkham Knight, Mortal Kombat X, Sonic Boom, Mario Kart 8, Battlefield Hardline, Forza Horizon 2, PSO2's English chance",
      "id" : 468,
      "media_link" : "http://www.giantbomb.com/podcasts/download/882/Giant_Bombcast_06_03_2014-06-03-2014-6302240437.mp3"
   },
   {
      "image" : "http://static.giantbomb.com/uploads/original/0/329/2637664-watch_dogs%E2%84%A2_20140527225809.jpg",
      "description" : "Games, games, games! We're talking about Watch Dogs, we're talking about The Order, we're talking about Driveclub, we're talking about The Evil Within, Lego Batman 3, UFC, Middle-earth: Shadow of Mordor, Evolve, the process of packing and moving, French v",
      "media_link" : "http://www.giantbomb.com/podcasts/download/876/Giant_Bombcast_05_27_2014-05-27-2014-8623408624.mp3",
      "id" : 469,
      "link" : "http://www.giantbomb.com/podcasts/giant-bombcast-05-27-2014/1600-876/",
      "external_id" : 876,
      "published_at" : "2014-05-27T22:10:00.000Z",
      "title" : "Giant Bombcast 05/27/2014"
   },
   {
      "image" : "http://static.giantbomb.com/uploads/original/0/1992/1753368-new_york.jpg",
      "link" : "http://www.giantbomb.com/podcasts/giant-bombcast-05-20-2014/1600-874/",
      "external_id" : 874,
      "published_at" : "2014-05-21T03:58:00.000Z",
      "title" : "Giant Bombcast 05/20/2014",
      "id" : 470,
      "media_link" : "http://www.giantbomb.com/podcasts/download/874/Giant_Bombcast_05_20_2014-05-20-2014-9456847568.mp3",
      "description" : "We break down the latest details in the Grand Giant Bomb Expansion Plan and then cover the Kinectless Xbox One, the relevance of E3, Nintendo's Wi-Fi Connection (or lack thereof), Rockstar, Superhot, Far Cry 4, that Halo stuff, Night Trap, and your emails"
   },
   {
      "image" : "http://static.giantbomb.com/uploads/original/0/31/2632576-8989261909-donat.jpg",
      "id" : 471,
      "description" : "Greg Kasavin and Danny O'Dwyer join us as we talk about Super Time Force, Sunset Overdrive, releasing a game, Eurovision, butt holes in your wall, and how many pillows is enough pillows.",
      "media_link" : "http://www.giantbomb.com/podcasts/download/869/Giant_Bombcast_05-13-2014-05-13-2014-7875783486.mp3",
      "link" : "http://www.giantbomb.com/podcasts/giant-bombcast-05-13-2014/1600-869/",
      "published_at" : "2014-05-14T03:00:00.000Z",
      "external_id" : 869,
      "title" : "Giant Bombcast 05/13/2014"
   },
   {
      "media_link" : "http://www.giantbomb.com/podcasts/download/860/Giant_Bombcast_05_06_2014-05-06-2014-5670117416.mp3",
      "description" : "The Giant Bomb Gang reconvenes to discuss the proper lineage of Datel's cheat devices, that Kevin Spacey Call of Duty thing, Sony's grip of indie announcements, DIsney's Marvel thing, the ambitions of Zenimax's legal team, and all that.",
      "id" : 472,
      "title" : "Giant Bombcast 05/06/2014",
      "published_at" : "2014-05-06T22:16:00.000Z",
      "external_id" : 860,
      "link" : "http://www.giantbomb.com/podcasts/giant-bombcast-05-06-2014/1600-860/",
      "image" : "http://static.giantbomb.com/uploads/original/9/93770/2362083-nes_nesplayactionfootball_2.jpg"
   },
   {
      "image" : "http://static.giantbomb.com/uploads/original/0/5768/714720-et.jpg",
      "description" : "We get ourselves into a room and discuss landfill diving for old video games, The Amazing Spider-Man 2, James Bond making out with imaginary ladies, firebombs, the new Skylanders, Colorado's view of Dave Lang, Vinny's hometown, and more!",
      "id" : 473,
      "media_link" : "http://www.giantbomb.com/podcasts/download/851/Giant_Bombcast_04_29_2014-04-29-2014-8897784909.mp3",
      "title" : "Giant Bombcast 04/29/2014",
      "link" : "http://www.giantbomb.com/podcasts/giant-bombcast-04-29-2014/1600-851/",
      "published_at" : "2014-04-30T03:17:00.000Z",
      "external_id" : 851
   },
   {
      "image" : "http://static.giantbomb.com/uploads/original/11/112517/1800160-nintendogameboybox.jpg",
      "external_id" : 839,
      "published_at" : "2014-04-23T01:05:00.000Z",
      "link" : "http://www.giantbomb.com/podcasts/giant-bombcast-04-22-2014/1600-839/",
      "title" : "Giant Bombcast 04/22/2014",
      "id" : 474,
      "description" : "We briefly celebrate the anniversary of the Game Boy and get into a little Trials Fusion before trying to figure out what the heck is happening over at Naughty Dog, what the heck is happening over at Bungie, and what the heck is up with Spider-Man on the",
      "media_link" : "http://www.giantbomb.com/podcasts/download/839/Giant_Bombcast_04_22_2014-04-22-2014-5434043186.mp3"
   },
   {
      "image" : "http://static.giantbomb.com/uploads/original/0/1992/2619859-dsc06222.jpg",
      "media_link" : "http://www.giantbomb.com/podcasts/download/831/Giant_Bombcast_04_15_2014-04-15-2014-1270640434.mp3",
      "id" : 475,
      "description" : "A trio of Giant Bomb compadres compare notes on PAX East 2014, Wrestlemania 2000, tank simulators, Trials Fusion, Snoop Dogg's latest release, Johnny Gat's latest cameo, drinking soda in front of a camera, and more stuff!",
      "published_at" : "2014-04-16T01:30:00.000Z",
      "external_id" : 831,
      "link" : "http://www.giantbomb.com/podcasts/giant-bombcast-04-15-2014/1600-831/",
      "title" : "Giant Bombcast 04/15/2014"
   },
   {
      "link" : "http://www.giantbomb.com/podcasts/giant-bombcast-04-08-2014/1600-825/",
      "published_at" : "2014-04-08T08:01:00.000Z",
      "external_id" : 825,
      "title" : "Giant Bombcast 04/08/2014",
      "id" : 476,
      "description" : "Brad returns from the wilderness of his mind to talk with us about Dark Souls II for the PC, that new Batman game, Amy Hennig's new Star Wars gig, the fine art of launching missiles, the appeal of Dynasty Warriors, our PAX East plans, Amazon's new Fire TV",
      "media_link" : "http://www.giantbomb.com/podcasts/download/825/Giant_Bombcast_04_08_2014-04-07-2014-3128964076.mp3",
      "image" : "http://static.giantbomb.com/uploads/original/0/26/2617315-screen+shot+2014-04-07+at+8.31.53+pm.png"
   },
   {
      "title" : "Giant Bombcast 04/01/2014",
      "published_at" : "2014-04-01T19:00:00.000Z",
      "external_id" : 814,
      "link" : "http://www.giantbomb.com/podcasts/giant-bombcast-04-01-2014/1600-814/",
      "id" : 477,
      "description" : "Illness befalls the Giant Bomb office and Vinny, Drew, and Jeff must soldier on to discuss Facebook's purchase of the Oculus Rift, Diablo III's new adventure mode, Elder Scrolls Online, the budding conflict between Liverpool and Manchester by way of Japan",
      "media_link" : "http://www.giantbomb.com/podcasts/download/814/Giant_Bombcast_04_01_2014-04-01-2014-3066935872.mp3",
      "image" : "http://static.giantbomb.com/uploads/original/0/26/2615444-screen+shot+2014-04-01+at+11.16.24+am.png"
   },
   {
      "link" : "http://www.giantbomb.com/podcasts/giant-bombcast-03-25-2014/1600-809/",
      "published_at" : "2014-03-26T00:12:00.000Z",
      "external_id" : 809,
      "title" : "Giant Bombcast 03/25/2014",
      "description" : "We clear away the post-GDC haze to discuss Sony's virtual reality plans, Metal Gear Solid V: Ground Zeroes, Arrowhead's new Gauntlet reboot, hot firmware updates, Infamous: Second Son, and another batch of profoundly terrible listener mail.",
      "id" : 478,
      "media_link" : "http://www.giantbomb.com/podcasts/download/809/Giant_Bombcast_03_25_2014-03-25-2014-1588770188.mp3",
      "image" : "http://static.giantbomb.com/uploads/original/0/26/2613351-toiletterrorist-cropped.jpg"
   },
   {
      "media_link" : "http://www.giantbomb.com/podcasts/download/799/Giant_Bombcast_03_18_2014-03-17-2014-2638143170.mp3",
      "description" : "We get a Chicago double as Patrick Klepek comes home to the Giant Bombcast for GDC week! Also, he brought Iron Galaxy's Dave Lang with him, and we discuss Luftrausers, Metal Gear Solid: Ground Zeroes, Dark Souls 2, and real steps you can take to make Wind",
      "id" : 479,
      "external_id" : 799,
      "published_at" : "2014-03-18T18:30:00.000Z",
      "link" : "http://www.giantbomb.com/podcasts/giant-bombcast-03-18-2014/1600-799/",
      "title" : "Giant Bombcast 03/18/2014",
      "image" : "http://static.giantbomb.com/uploads/original/7/74510/1376583-800px_cta_loop_junction.jpg"
   },
   {
      "image" : "http://static.giantbomb.com/uploads/original/0/2986/592851-new_jersey.gif",
      "title" : "Giant Bombcast 03/11/2014",
      "link" : "http://www.giantbomb.com/podcasts/giant-bombcast-03-11-2014/1600-790/",
      "external_id" : 790,
      "published_at" : "2014-03-12T00:45:00.000Z",
      "description" : "Drummer, professional traveler, and apparent Grim Reaper John Drake joins us to discuss the horrible things he's seen on the road, the release of Titanfall, the continued non-release of Driveclub, the release of Amy Hennig, the release of Jack Tretton, th",
      "id" : 480,
      "media_link" : "http://www.giantbomb.com/podcasts/download/790/Giant_Bombcast_03_11_2014-03-11-2014-8647357173.mp3"
   },
   {
      "image" : "http://static.giantbomb.com/uploads/original/1/14741/1109554-800px_flag_of_australia.svg.png",
      "external_id" : 781,
      "published_at" : "2014-03-05T03:03:00.000Z",
      "link" : "http://www.giantbomb.com/podcasts/giant-bombcast-03-04-2014/1600-781/",
      "title" : "Giant Bombcast 03/04/2014",
      "description" : "Your favorite Australian fashion podcast returns with a special video-game-themed episode! Thong talk alongside discussion of South Park, Castlevania: Lords of Shadow 2, the Diablo III patch, Loadout, and more? Sounds like a good time, mate! Koala bears.",
      "id" : 481,
      "media_link" : "http://www.giantbomb.com/podcasts/download/781/Giant_Bombcast_03_04_2014-03-04-2014-7188229639.mp3"
   },
   {
      "external_id" : 773,
      "published_at" : "2014-02-26T00:08:00.000Z",
      "link" : "http://www.giantbomb.com/podcasts/giant-bombcast-02-25-2014/1600-773/",
      "title" : "Giant Bombcast 02/25/2014",
      "description" : "Things heat up as the release calendar intensifies, forcing us to discuss hot new releases such as Thief, Plants vs. Zombies Garden Warfare, Castlevania: Lords of Shadow 2, Epic Pinball, and Tyrian.",
      "media_link" : "http://www.giantbomb.com/podcasts/download/773/Giant_Bombcast_02_25_2014-02-25-2014-2701629034.mp3",
      "id" : 482,
      "image" : "http://static.giantbomb.com/uploads/original/0/26/2604878-screen+shot+2014-02-25+at+4.02.58+pm.png"
   },
   {
      "description" : "Vinny leaves his home in search of information about the upcoming human/cyborg conflict while Jeff stays home to type \"start\" into a Twitch chat window over and over again. Drew flies a plane. Oh, and Brad Shoemaker rushes in to talk about that DLC for Th",
      "media_link" : "http://www.giantbomb.com/podcasts/download/761/Giant_Bombcast_02_18_2014-02-18-2014-6953565128.mp3",
      "id" : 483,
      "title" : "Giant Bombcast 02/18/2014",
      "published_at" : "2014-02-19T02:17:00.000Z",
      "external_id" : 761,
      "link" : "http://www.giantbomb.com/podcasts/giant-bombcast-02-18-2014/1600-761/",
      "image" : "http://static.giantbomb.com/uploads/original/3/34651/1251671-0robocop2.jpg"
   },
   {
      "id" : 484,
      "media_link" : "http://www.giantbomb.com/podcasts/download/755/Giant_Bombcast_02_11_2014-02-11-2014-3500376824.mp3",
      "description" : "The podcast gang reforms to discuss Super Metroid. Oh, and also Bravely Default, more horrific workplace nudity, Dungeon Keeper (not that one, the other one), Jeff's trip to the DICE Summit, Titanfall on the Xbox 360, the business of arcade games in laund",
      "link" : "http://www.giantbomb.com/podcasts/giant-bombcast-02-11-2014/1600-755/",
      "published_at" : "2014-02-12T00:24:00.000Z",
      "external_id" : 755,
      "title" : "Giant Bombcast 02/11/2014",
      "image" : "http://static.giantbomb.com/uploads/original/0/26/2600176-5117138906-defpo.jpg"
   },
   {
      "image" : "http://static.giantbomb.com/uploads/original/0/31/2598407-woodrightsshop.jpg",
      "media_link" : "http://www.giantbomb.com/podcasts/download/750/Giant_Bombcast_02-04-2014-02-04-2014-5426536629.mp3",
      "id" : 485,
      "description" : "Will Smith and Dave Snider join us as we swap tales of games, space battles, and workplace nightmare scenarios. Everything a good woodworking podcast needs.",
      "title" : "Giant Bombcast 02/04/2014",
      "external_id" : 750,
      "published_at" : "2014-02-05T04:47:00.000Z",
      "link" : "http://www.giantbomb.com/podcasts/giant-bombcast-02-04-2014/1600-750/"
   },
   {
      "title" : "Giant Bombcast 01/28/2014",
      "link" : "http://www.giantbomb.com/podcasts/giant-bombcast-01-28-2014/1600-741/",
      "external_id" : 741,
      "published_at" : "2014-01-28T20:30:00.000Z",
      "description" : "Vinny practices The Castle Doctrine while Jeff makes a serious attempt to become a Strider. Meanwhile, Drew gets into something wild while Brad continues to suffer from a crippling MOBA addiction. Also, we talk Nintendo, getting \"Genesis big,\" Las Vegas,",
      "media_link" : "http://www.giantbomb.com/podcasts/download/741/Giant_Bombcast_01_28_2014-01-28-2014-5085227788.mp3",
      "id" : 486,
      "image" : "http://static.giantbomb.com/uploads/original/1/17172/1414830-magnifyingglass.png"
   },
   {
      "id" : 487,
      "description" : "Giant Bomb checks in this week with timely coverage of Dark Souls, Broken Age, OlliOlli, Beyond 2000, cataloguing your classics, how to kill the teens of Maniac Mansion, and the precise number of Atari 2600s a person should own.",
      "media_link" : "http://www.giantbomb.com/podcasts/download/730/Giant_Bombcast_01_21_2014-01-21-2014-6673464685.mp3",
      "external_id" : 730,
      "published_at" : "2014-01-22T04:59:00.000Z",
      "link" : "http://www.giantbomb.com/podcasts/giant-bombcast-01-21-2014/1600-730/",
      "title" : "Giant Bombcast 01/21/2014",
      "image" : "http://static.giantbomb.com/uploads/original/8/87790/2209399-box_bds.png"
   },
   {
      "external_id" : 725,
      "published_at" : "2014-01-14T22:21:00.000Z",
      "link" : "http://www.giantbomb.com/podcasts/giant-bombcast-01-14-2014/1600-725/",
      "title" : "Giant Bombcast 01/14/2014",
      "media_link" : "http://www.giantbomb.com/podcasts/download/725/Giant_Bombcast_01_14_2014-01-14-2014-5628903382.mp3",
      "id" : 488,
      "description" : "The health experts at Giant Bomb finally wade into the flu vaccine debate, then we discuss the deeper nuances of Action Biker for the Commodore 64, some of this Dota 2 business, and end up talking about Ryu's magical/not-magical abilities some more.",
      "image" : "http://static.giantbomb.com/uploads/original/0/26/2590456-0571398981-flu_v.jpg"
   },
   {
      "title" : "Giant Bombcast 01/07/2014",
      "link" : "http://www.giantbomb.com/podcasts/giant-bombcast-01-07-2014/1600-714/",
      "published_at" : "2014-01-07T08:00:00.000Z",
      "external_id" : 714,
      "description" : "It's CES week, so you know that means it's time to talk televisions! Get down and dirty with our resolution resolutions for 2014... or should we say 2014K????? Because 4K televisions, you know? Anyway, video games.",
      "media_link" : "http://www.giantbomb.com/podcasts/download/714/Giant_Bombcast_01_07_2014-01-06-2014-8759117537.mp3",
      "id" : 489,
      "image" : "http://static.giantbomb.com/uploads/original/0/26/2587549-bdv7itccqaawnzt.jpg"
   },
   {
      "external_id" : 713,
      "published_at" : "2013-12-31T04:24:00.000Z",
      "link" : "http://www.giantbomb.com/podcasts/giant-bombcast-12-31-2013/1600-713/",
      "title" : "Giant Bombcast 12/31/2013",
      "id" : 490,
      "media_link" : "http://www.giantbomb.com/podcasts/download/713/Giant_Bombcast_12_31_2013-12-30-2013-9364940467.mp3",
      "description" : "This episode of the Giant Bombcast was filmed live in front of a webcam audience. The audio is pretty rough for the first five minutes, then it gets better. But it's still not as good as it sounds when we're in a studio, because we weren't in a studio. Th",
      "image" : "http://static.giantbomb.com/uploads/original/0/26/2584961-screen+shot+2013-12-30+at+5.29.41+pm.png"
   },
   {
      "published_at" : "2013-12-27T18:00:00.000Z",
      "external_id" : 708,
      "link" : "http://www.giantbomb.com/podcasts/giant-bomb-game-of-the-year-2013-day-five/1600-708/",
      "title" : "Giant Bomb Game of the Year 2013: Day Five",
      "description" : "The final day is upon us, so sit down and get angry as we determine Giant Bomb's Best Horror Game, \"Please Stop,\" Worst Game, and Best Game. Best game!",
      "id" : 491,
      "media_link" : "http://www.giantbomb.com/podcasts/download/708/Giant_Bomb_Game_of_the_Year_2013__Day_Five-12-27-2013-0695800211.mp3",
      "image" : "http://static.giantbomb.com/uploads/original/0/26/2583575-goty05.jpg"
   },
   {
      "image" : "http://static.giantbomb.com/uploads/original/0/26/2583463-goty04.jpg",
      "id" : 492,
      "description" : "Day four is here and it's time to talk about 2013's Hottest Mess, Best Moment or Sequence, Best Use of a Licensed Song, and the Biggest News.",
      "media_link" : "http://www.giantbomb.com/podcasts/download/707/Giant_Bomb_Game_of_the_Year_2013__Day_Four-12-18-2013-6322669313.mp3",
      "title" : "Giant Bomb Game of the Year 2013: Day Four",
      "link" : "http://www.giantbomb.com/podcasts/giant-bomb-game-of-the-year-2013-day-four/1600-707/",
      "published_at" : "2013-12-26T18:00:00.000Z",
      "external_id" : 707
   },
   {
      "title" : "Giant Bomb Game of the Year 2013: Day Three",
      "link" : "http://www.giantbomb.com/podcasts/giant-bomb-game-of-the-year-2013-day-three/1600-706/",
      "published_at" : "2013-12-25T18:00:00.000Z",
      "external_id" : 706,
      "id" : 493,
      "description" : "Strap in and prepare yourself as we get set to debate Best Exclusive Launch Game, Apology of the Year, Best Trend, and Best Debut.",
      "media_link" : "http://www.giantbomb.com/podcasts/download/706/Giant_Bomb_Game_of_the_Year_2013__Day_Three-12-18-2013-1239288012.mp3",
      "image" : "http://static.giantbomb.com/uploads/original/0/26/2583126-goty03.jpg"
   },
   {
      "image" : "http://static.giantbomb.com/uploads/original/0/26/2582714-goty02.jpg",
      "media_link" : "http://www.giantbomb.com/podcasts/download/705/Giant_Bomb_Game_of_the_Year_2013__Day_Two-12-18-2013-5933778061.mp3",
      "id" : 494,
      "description" : "Giant Bomb's deliberations continue as we determine the winners of Best Story, Best Music, Most Disappointing Game, and Best New Character.",
      "title" : "Giant Bomb Game of the Year 2013: Day Two",
      "external_id" : 705,
      "published_at" : "2013-12-24T18:00:00.000Z",
      "link" : "http://www.giantbomb.com/podcasts/giant-bomb-game-of-the-year-2013-day-two/1600-705/"
   },
   {
      "media_link" : "http://www.giantbomb.com/podcasts/download/704/Giant_Bomb_Game_of_the_Year_2013__Day_One-12-23-2013-6235941552.mp3",
      "description" : "We convene to determine the winners of 2013â€™s Old Game of the Year, URL of the Year, Best Surprise, and Best-Looking Game as this year's Game of the Year presentation commences!",
      "id" : 495,
      "external_id" : 704,
      "published_at" : "2013-12-23T18:00:00.000Z",
      "link" : "http://www.giantbomb.com/podcasts/giant-bomb-game-of-the-year-2013-day-one/1600-704/",
      "title" : "Giant Bomb Game of the Year 2013: Day One",
      "image" : "http://static.giantbomb.com/uploads/original/0/26/2582603-goty01.jpg"
   },
   {
      "image" : "http://static.giantbomb.com/uploads/original/14/147995/2403972-2403971-bradcopmaker.png",
      "id" : 496,
      "description" : "We close out the year in \"typical\" podcasting with one that's loaded up solid with your emails.",
      "media_link" : "http://www.giantbomb.com/podcasts/download/701/Giant_Bombcast_12_17_2013-12-17-2013-3875729167.mp3",
      "external_id" : 701,
      "published_at" : "2013-12-17T20:55:00.000Z",
      "link" : "http://www.giantbomb.com/podcasts/giant-bombcast-12-17-2013/1600-701/",
      "title" : "Giant Bombcast 12/17/2013"
   },
   {
      "id" : 497,
      "description" : "The crew convenes just before beginning the long trek to determine Giant Bomb's Official and Binding Game of the Year for 2013 to talk about Peggle 2, Starbound, Doki-Doki Universe, and other such video games.",
      "media_link" : "http://www.giantbomb.com/podcasts/download/695/Giant_Bombcast_12_10_2013-12-10-2013-8484855914.mp3",
      "link" : "http://www.giantbomb.com/podcasts/giant-bombcast-12-10-2013/1600-695/",
      "published_at" : "2013-12-11T00:30:00.000Z",
      "external_id" : 695,
      "title" : "Giant Bombcast 12/10/2013",
      "image" : "http://static.giantbomb.com/uploads/original/2/26790/2532497-starbound-2013-07-15-00-09-56-65.png"
   },
   {
      "image" : "http://static.giantbomb.com/uploads/original/0/26/2576899-6770324101-dsc01.jpg",
      "external_id" : 688,
      "published_at" : "2013-12-04T03:28:00.000Z",
      "link" : "http://www.giantbomb.com/podcasts/giant-bombcast-12-03-2013/1600-688/",
      "title" : "Giant Bombcast 12/03/2013",
      "id" : 498,
      "media_link" : "http://www.giantbomb.com/podcasts/download/688/Giant_Bombcast_12_03_2013-12-03-2013-3147673971.mp3",
      "description" : "\"Eastside\" Alex Navarro comes to town to discuss cold weather and trampolines, but the rest of us are on-hand to discuss video games! (Also, Thanksgiving.)"
   },
   {
      "image" : "http://static.giantbomb.com/uploads/original/0/26/2574616-screen+shot+2013-11-26+at+2.41.46+pm.png",
      "title" : "Giant Bombcast 11/26/2013",
      "external_id" : 679,
      "published_at" : "2013-11-26T22:44:00.000Z",
      "link" : "http://www.giantbomb.com/podcasts/giant-bombcast-11-26-2013/1600-679/",
      "id" : 499,
      "description" : "Atlus gets serious about another generation of video game consoles, Drew goes for a run. Brad and Vinny think about earning PP while Jeff lives the life of a pirate.",
      "media_link" : "http://www.giantbomb.com/podcasts/download/679/Giant_Bombcast_11_26_2013-11-26-2013-2215563273.mp3"
   },
   {
      "id" : 500,
      "description" : "\"Scoops\" of the popular morning show, Scoops &amp; The Wolf, joins the team for a special video-game-themed episode, where we discuss current generation video game devices, like the Sony PlayStation 4, Microsoft Xbox One, and Nintendo Wii U.",
      "media_link" : "http://www.giantbomb.com/podcasts/download/677/Giant_Bombcast_11_19_2013-11-19-2013-9325442542.mp3",
      "title" : "Giant Bombcast 11/19/2013",
      "link" : "http://www.giantbomb.com/podcasts/giant-bombcast-11-19-2013/1600-677/",
      "published_at" : "2013-11-20T05:00:00.000Z",
      "external_id" : 677,
      "image" : "http://static.giantbomb.com/uploads/original/0/2840/2495534-xboxone_dayonecontroller_f_blackbg_rgb_2013.png"
   },
   {
      "image" : "http://static.giantbomb.com/uploads/original/0/31/2570020-bombcast_11122013.jpg",
      "title" : "Giant Bombcast 11/12/2013",
      "published_at" : "2013-11-13T04:15:00.000Z",
      "external_id" : 671,
      "link" : "http://www.giantbomb.com/podcasts/giant-bombcast-11-12-2013/1600-671/",
      "description" : "Brad talks about Dota 2, Jeff shares his years of industry knowledge, and Drew recalls his weekend adventures. EVERYTHING IS UNDER CONTROL!",
      "id" : 501,
      "media_link" : "http://www.giantbomb.com/podcasts/download/671/Giant_Bombcast_11-12-2013-11-12-2013-1102562319.mp3"
   },
   {
      "image" : "http://static.giantbomb.com/uploads/original/0/26/2567906-5785865661-tcane.gif",
      "title" : "Giant Bombcast 11/05/2013: That's a Tuesday!",
      "link" : "http://www.giantbomb.com/podcasts/giant-bombcast-11-05-2013-that-s-a-tuesday/1600-660/",
      "published_at" : "2013-11-06T03:44:00.000Z",
      "external_id" : 660,
      "id" : 502,
      "description" : "The Giant Bomb Gang reflects on its marathon livestreaming weekend while discussing deep Windjammers strats, Call of Duty For Ghosts, Kameo, that ill-advised pizza order, how to give candy to children, and a distinct lack of Diretide.",
      "media_link" : "http://www.giantbomb.com/podcasts/download/660/Giant_Bombcast_11_05_2013-11-05-2013-7882472573.mp3"
   },
   {
      "description" : "Drew gets deep into video game nudity while Vinny explores his piratical side. Jeff and Brad steal a big-rig full of beer and attempt to smuggle it into Dota City before sundown.",
      "id" : 503,
      "media_link" : "http://www.giantbomb.com/podcasts/download/653/Giant_Bombcast_10_29_2013-10-29-2013-1197784306.mp3",
      "title" : "Giant Bombcast 10/29/2013",
      "link" : "http://www.giantbomb.com/podcasts/giant-bombcast-10-29-2013/1600-653/",
      "published_at" : "2013-10-30T00:19:00.000Z",
      "external_id" : 653,
      "image" : "http://static.giantbomb.com/uploads/original/0/26/2565251-screen+shot+2013-10-29+at+4.26.55+pm.png"
   },
   {
      "image" : "http://static.giantbomb.com/uploads/original/0/31/2562513-bombcast_102213.jpg",
      "description" : "With Jeff out of town we get a chance to savor topics including Beyond: Two Souls, the PS4, The Stanley Parable, and our legitimate concerns about the Holodeck. It's the most grande Bombcast ever!",
      "id" : 504,
      "media_link" : "http://www.giantbomb.com/podcasts/download/649/Giant_Bombcast_10-22-2013-10-22-2013-4122474550.mp3",
      "published_at" : "2013-10-22T22:30:00.000Z",
      "external_id" : 649,
      "link" : "http://www.giantbomb.com/podcasts/giant-bombcast-10-22-2013/1600-649/",
      "title" : "Giant Bombcast 10/22/2013"
   },
   {
      "image" : "http://static.giantbomb.com/uploads/original/0/26/2559632-1144329883-10822.jpg",
      "id" : 505,
      "description" : "Jeff warns the team of the dangers of pipe dope while Vinny misses his winDOw. Brad and Drew atTempt to find new wAys 2 receive the signal.",
      "media_link" : "http://www.giantbomb.com/podcasts/download/643/Giant_Bombcast_10_15_2013-10-14-2013-7663235008.mp3",
      "title" : "Giant Bombcast 10/15/2013",
      "link" : "http://www.giantbomb.com/podcasts/giant-bombcast-10-15-2013/1600-643/",
      "published_at" : "2013-10-15T08:00:00.000Z",
      "external_id" : 643
   },
   {
      "title" : "Giant Bombcast 10/08/2013",
      "link" : "http://www.giantbomb.com/podcasts/giant-bombcast-10-08-2013/1600-636/",
      "published_at" : "2013-10-08T08:14:00.000Z",
      "external_id" : 636,
      "description" : "Vinny attempts to live out his solo crime saga while Jeff bangs his head against Grand Theft Auto V's online component. Meanwhile, Drew learns a valuable lesson about a different kind of automotive thievery. Brad buys a Wii U in preparation for the inevit",
      "id" : 506,
      "media_link" : "http://www.giantbomb.com/podcasts/download/636/Giant_Bombcast_10_08_2013-10-07-2013-4095449050.mp3",
      "image" : "http://static.giantbomb.com/uploads/original/0/26/2556854-5599477670-BVSFg.jpg"
   },
   {
      "image" : "http://static.giantbomb.com/uploads/original/0/26/2553744-99.jpg",
      "title" : "Giant Bombcast 10/01/2013",
      "link" : "http://www.giantbomb.com/podcasts/giant-bombcast-10-01-2013/1600-631/",
      "published_at" : "2013-10-01T20:08:00.000Z",
      "external_id" : 631,
      "id" : 507,
      "description" : "The gang reconvenes to discuss Brad's Grand Theft Auto V vacation, Jeff's love of thunderstorms, Steam's odd future, Drew's descent into ArmA III, the power of alcohol, Vinny's voicework career, and the idea of playing Dota 2 on a controller.",
      "media_link" : "http://www.giantbomb.com/podcasts/download/631/Giant_Bombcast_10-01-2013-10-01-2013-9955184419.mp3"
   },
   {
      "id" : 508,
      "description" : "With that pesky Brad Shoemaker out on vacation, we can finally get down and dirty with the rest of the team's favorite game, Dota 2. Grand Theft Auto V, America's Cup, fireworks, SteamOS, and way more video games are also discussed.",
      "media_link" : "http://www.giantbomb.com/podcasts/download/626/Giant_Bombcast_09-24-2013-09-24-2013-1386042150.mp3",
      "link" : "http://www.giantbomb.com/podcasts/giant-bombcast-09-24-2013/1600-626/",
      "published_at" : "2013-09-24T22:42:00.000Z",
      "external_id" : 626,
      "title" : "Giant Bombcast 09/24/2013",
      "image" : "http://static.giantbomb.com/uploads/original/8/80045/2483350-exnflqw.jpg"
   },
   {
      "image" : "http://static.giantbomb.com/uploads/original/0/26/2547804-pod.jpg",
      "external_id" : 615,
      "published_at" : "2013-09-17T23:45:00.000Z",
      "link" : "http://www.giantbomb.com/podcasts/giant-bombcast-09-17-2013/1600-615/",
      "title" : "Giant Bombcast 09-17-2013",
      "id" : 509,
      "description" : "Jeff has some things to say about Grand Theft Auto V while Vinny attempts to talk Brad off the ledge after a dismal Dota 2 weekend. Meanwhile Drew looks on from his jet simulator, disapprovingly.",
      "media_link" : "http://www.giantbomb.com/podcasts/download/615/Giant_Bombcast_09-17-2013-09-17-2013-2634438812.mp3"
   },
   {
      "id" : 510,
      "media_link" : "http://www.giantbomb.com/podcasts/download/606/Giant_Bombcast_09-10-2013-09-10-2013-3113540700.mp3",
      "description" : "Vinny returns from vacation with a secret. Brad ponders the fate of open-world video games. Drew crashes a Jetski. Jeff looks on, disapprovingly. Dota 2 gets caught up in a liquor store heist gone horribly wrong.",
      "title" : "Giant Bombcast 09-10-2013",
      "link" : "http://www.giantbomb.com/podcasts/giant-bombcast-09-10-2013/1600-606/",
      "published_at" : "2013-09-10T22:42:00.000Z",
      "external_id" : 606,
      "image" : "http://static.giantbomb.com/uploads/original/11/112916/1558093-933037_20080320_screen028.jpg"
   },
   {
      "title" : "Giant Bombcast 09-03-2013",
      "published_at" : "2013-09-04T03:15:00.000Z",
      "external_id" : 598,
      "link" : "http://www.giantbomb.com/podcasts/giant-bombcast-09-03-2013/1600-598/",
      "description" : "Jeff, Brad, and Drew go over their final PAX notes to discuss Samurai Gunn, Grand Theft Auto V, Steamworld Dig, games for the Vita, extreme PAX panel injuries, D.O.T.A. II, potential butt energy, and a hot grip of your emails on this emails-focused podcas",
      "media_link" : "http://www.giantbomb.com/podcasts/download/598/Giant_Bombcast_09-03-2013-09-03-2013-1304577914.mp3",
      "id" : 511,
      "image" : "http://static.giantbomb.com/uploads/original/0/26/2540154-img_4436.jpeg"
   },
   {
      "external_id" : 582,
      "published_at" : "2013-08-27T20:37:00.000Z",
      "link" : "http://www.giantbomb.com/podcasts/giant-bombcast-08-27-2013/1600-582/",
      "title" : "Giant Bombcast 08/27/2013",
      "id" : 512,
      "media_link" : "http://www.giantbomb.com/podcasts/download/582/Giant_Bombcast_08_27_2013-08-27-2013-8452286629.mp3",
      "description" : "This week's podcast gets down and dirty on the real with further discussion of submarines, Saints Row IV, Lost Planet 3, Splinter Cell, trying to buy a hybrid, Final Fantasy XIV-2, bathroom design, how to handle dust, and all the Dota 2 that you can possi",
      "image" : "http://static.giantbomb.com/uploads/original/0/26/2535872-cwv9610_1xl.jpg"
   },
   {
      "media_link" : "http://www.giantbomb.com/podcasts/download/558/Giant_Bombcast_08-20-2013-08-20-2013-6482388917.mp3",
      "id" : 513,
      "description" : "The gang gets together to discuss John Cena's catchphrase, the magic of Disney Infinity, the even-more-magic of krokodil, Dota 2, Gone Home, Ultima Forever vs. Plants vs. Zombies, War Thunder, GTA Online, and the value of pretending to be into football.",
      "title" : "Giant Bombcast 08-20-2013",
      "link" : "http://www.giantbomb.com/podcasts/giant-bombcast-08-20-2013/1600-558/",
      "published_at" : "2013-08-20T22:45:00.000Z",
      "external_id" : 558,
      "image" : "http://static.giantbomb.com/uploads/original/16/162639/2258237-vector_team_chaotix_archie_17352306_300_362.jpg"
   },
   {
      "id" : 514,
      "description" : "The Giant Bomb Podcast Gang reconvenes to talk about Microsoft's inability to commit, Vinny's ability to Pikmin, introducing new people to the Oculus Rift, and a new multiplayer online battle arena video game called Dota II.",
      "media_link" : "http://www.giantbomb.com/podcasts/download/549/Giant_Bombcast_08-13-2013-08-13-2013-7427145023.mp3",
      "link" : "http://www.giantbomb.com/podcasts/giant-bombcast-08-13-2013/1600-549/",
      "published_at" : "2013-08-14T00:07:00.000Z",
      "external_id" : 549,
      "title" : "Giant Bombcast 08-13-2013",
      "image" : "http://static.giantbomb.com/uploads/original/0/26/2528997-yothisdogisrabid.jpg"
   },
   {
      "image" : "http://static.giantbomb.com/uploads/original/0/26/2525981-luke_banned_1990_original.jpg",
      "title" : "Giant Bombcast 08-06-2013",
      "external_id" : 546,
      "published_at" : "2013-08-06T19:12:00.000Z",
      "link" : "http://www.giantbomb.com/podcasts/giant-bombcast-08-06-2013/1600-546/",
      "description" : "We pile five-deep into a room to discuss the finer points of Uncle Luke, the magic of iRacing, Bioshock Infinite's add-ons, what it's like to speak directly to the Ultimate Warrior, beeeeeees, Atlus, and why you should NEVER bet on DBZ. Dota 2.",
      "id" : 515,
      "media_link" : "http://www.giantbomb.com/podcasts/download/546/Giant_Bombcast_08-06-2013-08-06-2013-0278477157.mp3"
   },
   {
      "image" : "http://static.giantbomb.com/uploads/original/0/4527/463755-reel_fishing_front.jpg",
      "id" : 516,
      "media_link" : "http://www.giantbomb.com/podcasts/download/542/Giant_Bombcast_07-30-2013-07-30-2013-9341493554.mp3",
      "description" : "The cast and crew of Giant Bomb dot com get together to discuss the PAX 10, Drew's trip to an aircraft carrier, Ridiculous Fishing, Phil Fishing, Reel Fishing, real fishing, and Valve's hot new online strategy game, Defense of the Ancients II.",
      "title" : "Giant Bombcast 07-30-2013",
      "external_id" : 542,
      "published_at" : "2013-07-31T01:59:00.000Z",
      "link" : "http://www.giantbomb.com/podcasts/giant-bombcast-07-30-2013/1600-542/"
   },
   {
      "image" : "http://static.giantbomb.com/uploads/original/0/26/2519321-screen+shot+2013-07-23+at+2.32.40+pm.png",
      "id" : 517,
      "media_link" : "http://www.giantbomb.com/podcasts/download/537/Giant_Bombcast_07-23-2013-07-23-2013-2286429067.mp3",
      "description" : "We let Zartan burn as we discuss the right time to release DLC, getting/being old, Rockapella, this \"Dota 2\" game, and that evil Nintendo salesrabbit.",
      "title" : "Giant Bombcast 07-23-2013",
      "published_at" : "2013-07-23T22:29:00.000Z",
      "external_id" : 537,
      "link" : "http://www.giantbomb.com/podcasts/giant-bombcast-07-23-2013/1600-537/"
   },
   {
      "description" : "Bombcast! continues with some bootleg high-pitched music, video games to play when you barely feel like playing video games, and... Dota 2. Yeah, again.",
      "id" : 518,
      "media_link" : "http://www.giantbomb.com/podcasts/download/533/Giant_Bombcast_07_16_2013-07-16-2013-6040807954.mp3",
      "link" : "http://www.giantbomb.com/podcasts/giant-bombcast-07-16-2013/1600-533/",
      "published_at" : "2013-07-16T20:34:00.000Z",
      "external_id" : 533,
      "title" : "Giant Bombcast 07-16-2013",
      "image" : "http://static.giantbomb.com/uploads/original/0/26/2516075-screen+shot+2013-07-16+at+12.03.30+pm.png"
   },
   {
      "image" : "http://static.giantbomb.com/uploads/original/0/31/2512300-bombcast_070813.jpg",
      "title" : "Giant Bombcast 07-09-2013",
      "published_at" : "2013-07-10T05:21:00.000Z",
      "external_id" : 530,
      "link" : "http://www.giantbomb.com/podcasts/giant-bombcast-07-09-2013/1600-530/",
      "description" : "Giant Bomb comes together to remember our dear friend and colleague, Ryan Davis.",
      "id" : 519,
      "media_link" : "http://www.giantbomb.com/podcasts/download/530/Giant_Bombcast_07-09-2013-07-09-2013-6792162740.mp3"
   },
   {
      "title" : "Giant Bombcast 07-02-2013",
      "published_at" : "2013-07-03T02:40:00.000Z",
      "external_id" : 527,
      "link" : "http://www.giantbomb.com/podcasts/giant-bombcast-07-02-2013/1600-527/",
      "description" : "Jeff, Brad, and Drew sit back and spin a yarn about surfing, the Saints, Don Mattrick, the infinite power of cloud magic, and... sure, numbers stations. Why not?",
      "media_link" : "http://www.giantbomb.com/podcasts/download/527/bombcast-070213-07-02-2013-8557520879.mp3",
      "id" : 520,
      "image" : "http://static.giantbomb.com/uploads/original/8/83365/1468041-now_this_is_how_you_crowd_surf_25508_1234977408_51.jpg"
   },
   {
      "image" : "http://static.giantbomb.com/uploads/original/0/27/2503512-2503502-8285261901-97.pn.png",
      "title" : "Giant Bombcast 06-25-2013",
      "published_at" : "2013-06-26T02:03:00.000Z",
      "external_id" : 526,
      "link" : "http://www.giantbomb.com/podcasts/giant-bombcast-06-25-2013/1600-526/",
      "media_link" : "http://www.giantbomb.com/podcasts/download/526/giantbombcast-062513-06-25-2013-0231862572.mp3",
      "description" : "We talk The Biggest Little City, The Last of Us, the fate of Phantasy Star Online 2, virtual Slurpee machines, Ken Levine's Logan's Run, bricked PlayStation 3s, Microsoft's shocking Xbox One DRM policy revision, and more!",
      "id" : 521
   },
   {
      "description" : "Before we ship Patrick off to the hot streets of Chicago, we get the gang back together to reflect on the events of E3 2013.",
      "id" : 522,
      "media_link" : "http://www.giantbomb.com/podcasts/download/519/giantbombcast-061813-06-18-2013-8232470618.mp3",
      "title" : "Giant Bombcast 06-18-2013",
      "link" : "http://www.giantbomb.com/podcasts/giant-bombcast-06-18-2013/1600-519/",
      "external_id" : 519,
      "published_at" : "2013-06-19T03:41:00.000Z",
      "image" : "http://static.giantbomb.com/uploads/original/0/27/2500425-2500417-sqyi06xtn88iiy6i.jpg"
   },
   {
      "image" : "http://static.giantbomb.com/uploads/original/0/27/2498850-2498840-screen%2Bshot%2B2013-06-14%2Bat%2B6.31.47%2Bpm.png",
      "media_link" : "http://www.giantbomb.com/podcasts/download/515/giantbombcast-061313-06-14-2013-0300348754.mp3",
      "description" : "E3 2013: case closed.",
      "id" : 523,
      "title" : "Giant Bombcast E3 2013 Day Three",
      "link" : "http://www.giantbomb.com/podcasts/giant-bombcast-e3-2013-day-three/1600-515/",
      "external_id" : 515,
      "published_at" : "2013-06-15T03:15:00.000Z"
   },
   {
      "image" : "http://static.giantbomb.com/uploads/original/0/27/2498167-2498166-screen%2Bshot%2B2013-06-13%2Bat%2B1.12.20%2Bpm.png",
      "title" : "Giant Bombcast E3 2013 Day Two",
      "external_id" : 513,
      "published_at" : "2013-06-13T21:16:00.000Z",
      "link" : "http://www.giantbomb.com/podcasts/giant-bombcast-e3-2013-day-two/1600-513/",
      "description" : "We bring Cliff Bleszinski, Jonathan Blow, Vince Zampella and the Respawn team, John Drake and Eric Pope from Harmonix, and Double Fine's own Brad Muir in for questioning.",
      "id" : 524,
      "media_link" : "http://www.giantbomb.com/podcasts/download/513/giantbombcast-061213-06-13-2013-0316788845.mp3"
   },
   {
      "external_id" : 509,
      "published_at" : "2013-06-12T20:24:00.000Z",
      "link" : "http://www.giantbomb.com/podcasts/giant-bombcast-e3-2013-day-one/1600-509/",
      "title" : "Giant Bombcast E3 2013 Day One",
      "media_link" : "http://www.giantbomb.com/podcasts/download/509/giantbombcast-061113-06-12-2013-7924892665.mp3",
      "id" : 525,
      "description" : "Special guests from Naughty Dog, Polygon, Gearbox, Game Informer, and more join us for our first nightly wrap-up from E3 2013. Includes bonus pre-show banter!",
      "image" : "http://static.giantbomb.com/uploads/original/0/27/2497563-2497559-tumblr_mo9lakbc7l1svu1rgo1_1280.png"
   },
   {
      "image" : "http://static.giantbomb.com/uploads/original/0/27/2496812-2496809-sealed-envelope.jpg",
      "description" : "Recorded prior to Monday's dramatic press conferences, Jeff shares more of his Judges' Week experiences, while the whole staff makes predictions that are, in hindsight, hilarious.",
      "id" : 526,
      "media_link" : "http://www.giantbomb.com/podcasts/download/502/sealedenvelope2013-06-11-2013-2210449783.mp3",
      "title" : "Giant Bombcast E3 2013: The Sealed Envelope",
      "link" : "http://www.giantbomb.com/podcasts/giant-bombcast-e3-2013-the-sealed-envelope/1600-502/",
      "published_at" : "2013-06-11T20:00:00.000Z",
      "external_id" : 502
   },
   {
      "image" : "http://static.giantbomb.com/uploads/original/0/27/2492341-2492339-img_0092.jpg",
      "id" : 527,
      "media_link" : "http://www.giantbomb.com/podcasts/download/497/giantbombcast-060413-06-04-2013-9645276337.mp3",
      "description" : "We stress out about E3s past and future, free-to-play games, Kickstarter, and more! Mostly E3, though.",
      "external_id" : 497,
      "published_at" : "2013-06-05T02:39:00.000Z",
      "link" : "http://www.giantbomb.com/podcasts/giant-bombcast-06-04-2013/1600-497/",
      "title" : "Giant Bombcast 06-04-2013"
   },
   {
      "title" : "Giant Bombcast 05-28-2013",
      "external_id" : 493,
      "published_at" : "2013-05-29T04:30:00.000Z",
      "link" : "http://www.giantbomb.com/podcasts/giant-bombcast-05-28-2013/1600-493/",
      "id" : 528,
      "description" : "Vinny dives into the sordid world of voice-acting for toys and grapples with gophers, Jeff shares his first weekend with the Oculus Rift, and we all discuss FUSE, Valve economics, next-gen aftermarkets, The Swapper, the dark side of Star Trek, and more!",
      "media_link" : "http://www.giantbomb.com/podcasts/download/493/giantbombcast-052813-05-28-2013-2849958759.mp3",
      "image" : "http://static.giantbomb.com/uploads/original/0/27/2489431-2489428-z-ken-ici-bottasgopher.jpg"
   },
   {
      "media_link" : "http://www.giantbomb.com/podcasts/download/489/giantbombcast-052113-05-21-2013-3857876423.mp3",
      "id" : 529,
      "description" : "Hot on the heels of Microsoft's Xbox One reveal event, we talk at length about the forthcoming next-gen console battle. Also Star Trek. And spiders. Go Bears!",
      "link" : "http://www.giantbomb.com/podcasts/giant-bombcast-05-21-2013/1600-489/",
      "published_at" : "2013-05-22T03:29:00.000Z",
      "external_id" : 489,
      "title" : "Giant Bombcast 05-21-2013",
      "image" : "http://static.giantbomb.com/uploads/original/0/27/2486192-2486167-2386870555-dmack.jpg"
   },
   {
      "image" : "http://static.giantbomb.com/uploads/original/0/27/2483034-2483033-8954777318-2013-.jpg",
      "title" : "Giant Bombcast 05-14-2013",
      "published_at" : "2013-05-15T04:03:00.000Z",
      "external_id" : 486,
      "link" : "http://www.giantbomb.com/podcasts/giant-bombcast-05-14-2013/1600-486/",
      "media_link" : "http://www.giantbomb.com/podcasts/download/486/giantbombcast-051413-05-14-2013-0194410179.mp3",
      "id" : 530,
      "description" : "With Jeff out of the office on pre-E3 business, we spend an inordinate amount of time on Durango speculation while also finding the time to talk Metro: Last Light, Wolfenstein: The New Order, Prison Architect, and more!"
   },
   {
      "image" : "http://static.giantbomb.com/uploads/original/0/27/2479905-2479904-il_fullxfull.340593282.jpg",
      "title" : "Giant Bombcast 05-07-2013",
      "external_id" : 481,
      "published_at" : "2013-05-07T17:17:00.000Z",
      "link" : "http://www.giantbomb.com/podcasts/giant-bombcast-05-07-2013/1600-481/",
      "media_link" : "http://www.giantbomb.com/podcasts/download/481/giantbombcast-050713-05-07-2013-5700375490.mp3",
      "id" : 531,
      "description" : "Ryan mistakes Bob Hoskins for dead; Jeff loves Riff-Raff; Vinny loves sleep; Brad loves Dota 2; Patrick loves Ellen; the gang learns what the best console is; the Shmoo is real."
   },
   {
      "image" : "http://static.giantbomb.com/uploads/original/0/27/2477115-2477113-m_1449820001.jpg",
      "link" : "http://www.giantbomb.com/podcasts/giant-bombcast-04-30-2013/1600-477/",
      "published_at" : "2013-05-01T03:52:00.000Z",
      "external_id" : 477,
      "title" : "Giant Bombcast 04-30-2013",
      "id" : 532,
      "description" : "Patrick's back from Iceland with three solid hours of Bjork stories.",
      "media_link" : "http://www.giantbomb.com/podcasts/download/477/giantbombcast-043013-04-30-2013-4160497134.mp3"
   },
   {
      "title" : "Giant Bombcast 04-23-2013",
      "external_id" : 471,
      "published_at" : "2013-04-23T18:00:00.000Z",
      "link" : "http://www.giantbomb.com/podcasts/giant-bombcast-04-23-2013/1600-471/",
      "id" : 533,
      "description" : "Brad discovers a use for interns in Dota 2; Patrick prepares for Reyjkavik; Ryan endorses the Neti pot; Jeff is assaulted by the Neti pot; Vinny hangs drywall.",
      "media_link" : "http://www.giantbomb.com/podcasts/download/471/giantbombcast-042313-04-23-2013-7144073873.mp3",
      "image" : "http://static.giantbomb.com/uploads/original/0/27/2473040-screen+shot+2013-04-23+at+8.36.21+am.png"
   },
   {
      "link" : "http://www.giantbomb.com/podcasts/giant-bombcast-04-16-2013/1600-465/",
      "published_at" : "2013-04-17T03:55:00.000Z",
      "external_id" : 465,
      "title" : "Giant Bombcast 04-16-2013",
      "description" : "Vinny finds new homes for old possessions; Jeff fantasizes about his own Coke Freestyle machine; Patrick considers a new hat; Ryan is sleepy; Brad is named Bombcast Ombudsman.",
      "media_link" : "http://www.giantbomb.com/podcasts/download/465/giantbombcast-041613-04-16-2013-0201643607.mp3",
      "id" : 534,
      "image" : "http://static.giantbomb.com/uploads/original/0/27/2470658-2470657-ombudsofficeseal.jpg"
   },
   {
      "id" : 535,
      "media_link" : "http://www.giantbomb.com/podcasts/download/461/giantbombcast-040913-04-09-2013-7192309871.mp3",
      "description" : "Vinny returns with harrowing tales of airplanes, babies, and bathtubs; Patrick combines his love of BioShock and Lost into a... Singularity; Jeff tries to make sense of Defiance; Brad falls down a Dota 2 hole; everyone mourns the passing of LucasArts.",
      "title" : "Giant Bombcast 04-09-2013",
      "link" : "http://www.giantbomb.com/podcasts/giant-bombcast-04-09-2013/1600-461/",
      "external_id" : 461,
      "published_at" : "2013-04-10T03:00:00.000Z",
      "image" : "http://static.giantbomb.com/uploads/original/0/27/2467613-2467612-0366147883-GAM17.jpg"
   },
   {
      "image" : "http://static.giantbomb.com/uploads/original/0/27/2464194-2464193-img_0462.jpg",
      "title" : "Giant Bombcast 04/02/2013",
      "link" : "http://www.giantbomb.com/podcasts/giant-bombcast-04-02-2013/1600-458/",
      "external_id" : 458,
      "published_at" : "2013-04-02T22:14:00.000Z",
      "description" : "After back-to-back PAX East and GDC, it's a decidedly low-key week on the Bombcast. We fight off the malaise with spoiler-free BioShock Infinite talk, Ouya impressions, Metal Gear Solid V thoughts, and more!",
      "id" : 536,
      "media_link" : "http://www.giantbomb.com/podcasts/download/458/giantbombcast-040213-04-02-2013-2876997714.mp3"
   },
   {
      "image" : "http://static.giantbomb.com/uploads/original/0/27/2460474-2460473-7388501781-Rhuba.JPG",
      "title" : "Giant Bombcast 03-26-2013",
      "external_id" : 447,
      "published_at" : "2013-03-27T02:12:00.000Z",
      "link" : "http://www.giantbomb.com/podcasts/giant-bombcast-03-26-2013/1600-447/",
      "description" : "Ryan, Jeff, and Patrick return from PAX East 2013 exhausted, excited, and looking forward to the shenanigans promised by GDC 2013. Now! Who wants pie?",
      "media_link" : "http://www.giantbomb.com/podcasts/download/447/giantbombcast-032613-03-26-2013-6388996833.mp3",
      "id" : 537
   },
   {
      "image" : "http://static.giantbomb.com/uploads/original/0/26/2457569-screen+shot+2013-03-19+at+7.54.19+pm.png",
      "id" : 538,
      "description" : "We talk about \"smart\" watches and the inevitable Cyborg Wars while occasionally slipping into a little Gears of War: Judgment, Monster Hunter (!?!?!), and mooooore.",
      "media_link" : "http://www.giantbomb.com/podcasts/download/433/Giant_Bombcast_03_19_2013-03-19-2013-2629611409.mp3",
      "external_id" : 433,
      "published_at" : "2013-03-20T03:55:00.000Z",
      "link" : "http://www.giantbomb.com/podcasts/giant-bombcast-03-19-2013/1600-433/",
      "title" : "Giant Bombcast 03-19-2013"
   },
   {
      "id" : 539,
      "description" : "We're downright feverish in our discussions of Mass Effect 3 DLC, God of War: Ascension, SimCity, Starcraft II: Heart of the Swarm, Thief, and more!",
      "media_link" : "http://www.giantbomb.com/podcasts/download/429/giantbombcast-031213-03-12-2013-6623072271.mp3",
      "title" : "Giant Bombcast 03-12-2013",
      "external_id" : 429,
      "published_at" : "2013-03-13T03:43:00.000Z",
      "link" : "http://www.giantbomb.com/podcasts/giant-bombcast-03-12-2013/1600-429/",
      "image" : "http://static.giantbomb.com/uploads/original/0/27/2454437-2454436-compsick.jpg"
   },
   {
      "media_link" : "http://www.giantbomb.com/podcasts/download/427/giantbombcast-030513-03-05-2013-9292667826.mp3",
      "id" : 540,
      "description" : "Ryan returns from Disneyland; Jeff and Vinny reinvent bath-time and mealtime; Brad falls down an apocalyptic rabbit hole; everyone has allergies.",
      "link" : "http://www.giantbomb.com/podcasts/giant-bombcast-03-05-2013/1600-427/",
      "external_id" : 427,
      "published_at" : "2013-03-06T02:08:00.000Z",
      "title" : "Giant Bombcast 03-05-2013",
      "image" : "http://static.giantbomb.com/uploads/original/0/27/2447118-2447114-tumblr_llnyjsybyj1qb4ej3o1_500.jpg"
   },
   {
      "title" : "Giant Bombcast 02/26/2013",
      "link" : "http://www.giantbomb.com/podcasts/giant-bombcast-02-26-2013/1600-423/",
      "published_at" : "2013-02-26T23:17:00.000Z",
      "external_id" : 423,
      "media_link" : "http://www.giantbomb.com/podcasts/download/423/Giant_Bombcast_02_26_2013-02-26-2013-2332756124.mp3",
      "id" : 541,
      "description" : "Jeff. Vinny, Brad, and Patrick talk over Metal Gear Rising, Crysis 3, the PlayStation 4, having a body full of foreign objects, Tomb Raider, and more.",
      "image" : "http://static.giantbomb.com/uploads/original/0/176/2440417-lb_0282_large_extra_large.jpeg"
   },
   {
      "image" : "http://static.giantbomb.com/uploads/original/0/27/2438754-old-snake.jpg",
      "title" : "Giant Bombcast 02-19-2013",
      "link" : "http://www.giantbomb.com/podcasts/giant-bombcast-02-19-2013/1600-399/",
      "external_id" : 399,
      "published_at" : "2013-02-20T03:57:00.000Z",
      "description" : "Everything new is old again as the Giant Bombcast feels the crushing weight of the unrelenting passage of time! With special guest star Dave Snider!",
      "media_link" : "http://www.giantbomb.com/podcasts/download/399/giantbombcast-021913-02-19-2013-2494468873.mp3",
      "id" : 542
   },
   {
      "id" : 543,
      "description" : "The pitfalls of potholes, rumored Durango specs, Hit Clips and MiniDiscs, The Witcher 3, Bald Paul Walker, JJ Abrams vs. Gabe Newell, the delay of Rayman Legends, Impossible Studiosâ€™ final mission, and if we sell enough GRIT then we can get a bike!",
      "media_link" : "http://www.giantbomb.com/podcasts/download/379/Giant_Bombcast_02-12-2013-02-12-2013-8655797447.mp3",
      "title" : "Giant Bombcast 02-12-2013",
      "link" : "http://www.giantbomb.com/podcasts/giant-bombcast-02-12-2013/1600-379/",
      "external_id" : 379,
      "published_at" : "2013-02-13T01:14:00.000Z",
      "image" : "http://static.giantbomb.com/uploads/original/0/27/2430362-weinergate-20110602-01.jpg"
   },
   {
      "published_at" : "2013-02-08T23:35:00.000Z",
      "external_id" : 378,
      "link" : "http://www.giantbomb.com/podcasts/giant-bombcast-2013-relaunch-psa/1600-378/",
      "title" : "Giant Bombcast 2013 Relaunch PSA",
      "id" : 544,
      "media_link" : "http://www.giantbomb.com/podcasts/download/378/giantbombcast-020813.mp3",
      "description" : "We're relaunching giantbomb.com on February 12, 2013! Here's how that may impact our beloved podcast listeners.",
      "image" : "http://static.giantbomb.com/uploads/original/0/27/2429845-winners_dont_use_drugs.png"
   },
   {
      "link" : "http://www.giantbomb.com/podcasts/giant-bombcast-02-05-2013/1600-377/",
      "published_at" : "2013-02-05T19:13:00.000Z",
      "external_id" : 377,
      "title" : "Giant Bombcast 02-05-2013",
      "id" : 545,
      "media_link" : "http://www.giantbomb.com/podcasts/download/377/giantbombcast-020513.mp3",
      "description" : "We might as well rename it the \"Fast and Furious\"â€¦cast.",
      "image" : "http://static.giantbomb.com/uploads/original/0/27/2427660-fast_five_2.jpg"
   },
   {
      "image" : "http://static.giantbomb.com/uploads/original/0/27/2430336-2423764-screen_shot_2013_01_29_at_3.33.16_pm.png",
      "title" : "Giant Bombcast 01-29-2013",
      "published_at" : "2013-01-29T23:24:00.000Z",
      "external_id" : 376,
      "link" : "http://www.giantbomb.com/podcasts/giant-bombcast-01-29-2013/1600-376/",
      "media_link" : "http://www.giantbomb.com/podcasts/download/376/giantbombcast-012913.mp3",
      "id" : 546,
      "description" : "We go spelunking in The Cave, compare the relative merits of the Underworld and Resident Evil film franchises, dig into the bureaucracy of SimCity, question the very nature of reality with Antichamber, and pour one out for THQ on this week's Bombcast!"
   },
   {
      "description" : "After spending no less than a half-hour talking about Yelp, the gang finally gets down to business with Letterpress, Ni no Kuni, Halo 4 spoilers, Kentucky Route Zero, Antichamber, and, of course, Beverly Hills Cop.",
      "media_link" : "http://www.giantbomb.com/podcasts/download/374/giantbombcast-012213.mp3",
      "id" : 547,
      "external_id" : 374,
      "published_at" : "2013-01-23T02:37:00.000Z",
      "link" : "http://www.giantbomb.com/podcasts/giant-bombcast-01-22-2013/1600-374/",
      "title" : "Giant Bombcast 01-22-2013",
      "image" : "http://static.giantbomb.com/uploads/original/0/27/2430337-2419214-2419213_2419207_323435_beverly_hills_cop_1_front.jpg"
   },
   {
      "id" : 548,
      "description" : "We talk flu watch, dog food, contentious furniture ownership, Black Ops II, Twin Peaks, Devil May Cry, and more!",
      "media_link" : "http://www.giantbomb.com/podcasts/download/373/giantbombcast-011513.mp3",
      "title" : "Giant Bombcast 01-15-2013",
      "published_at" : "2013-01-15T20:05:00.000Z",
      "external_id" : 373,
      "link" : "http://www.giantbomb.com/podcasts/giant-bombcast-01-15-2013/1600-373/",
      "image" : "http://static.giantbomb.com/uploads/original/0/27/2414165-tumblr_m59hq0juu41qemxfbo1_500.jpg"
   },
   {
      "image" : "http://static.giantbomb.com/uploads/original/0/27/2409927-2409925-jeff_goldblum_jeff_goldblum_13452924_1280_960.jpg",
      "id" : 549,
      "description" : "Everyone's back in the office and ready to grapple with the big issues of 2013, including Jeff Goldblum, Hundreds, Barkley Shut Up and Jam: Gaiden, Halo dÃ©jÃ  vu, the fate of THQ, the cost of doing next-gen business, Nvidia's Project Shield, fried chicke",
      "media_link" : "http://www.giantbomb.com/podcasts/download/371/giantbombcast-010813.mp3",
      "title" : "Giant Bombcast 01-08-2013",
      "link" : "http://www.giantbomb.com/podcasts/giant-bombcast-01-08-2013/1600-371/",
      "published_at" : "2013-01-08T22:44:00.000Z",
      "external_id" : 371
   },
   {
      "title" : "Giant Bombcast 01-01-2013",
      "published_at" : "2013-01-02T01:33:00.000Z",
      "external_id" : 370,
      "link" : "http://www.giantbomb.com/podcasts/giant-bombcast-01-01-2013/1600-370/",
      "id" : 550,
      "description" : "Everyone's still on vacation, but nothing stops the Bombcast! Not even dodgy Skype calls, illegal drinks, and the death of Dick Clark!",
      "media_link" : "http://www.giantbomb.com/podcasts/download/370/giantbombcast-010113.mp3",
      "image" : "http://static.giantbomb.com/uploads/original/0/27/2405951-dick_clark_thumb.jpg"
   },
   {
      "image" : "http://static.giantbomb.com/uploads/original/0/27/2401026-2400472_2400471_2394941_day1.jpg",
      "external_id" : 369,
      "published_at" : "2012-12-28T18:00:00.000Z",
      "link" : "http://www.giantbomb.com/podcasts/giant-bomb-game-of-the-year-2012-day-five/1600-369/",
      "title" : "Giant Bomb Game of the Year 2012: Day Five",
      "description" : "We close out our Game of the Year 2012 deliberations with our picks for Dumbest Motion-Controlled Moment, Best Trend, Biggest News, Worst Game, and finally, our pick for overall Game of the Year.",
      "media_link" : "http://www.giantbomb.com/podcasts/download/369/giantbombcast-goty2012-day5-1039.mp3",
      "id" : 551
   },
   {
      "image" : "http://static.giantbomb.com/uploads/original/0/27/2401026-2400472_2400471_2394941_day1.jpg",
      "id" : 552,
      "description" : "We choose winners for the WarioWare Spirit Award, Best Multiplayer, Best Download Game, Best Story, and Most Disappointing Game of 2012.",
      "media_link" : "http://www.giantbomb.com/podcasts/download/367/giantbombcast-goty2012-day4-3025.mp3",
      "published_at" : "2012-12-27T18:00:00.000Z",
      "external_id" : 367,
      "link" : "http://www.giantbomb.com/podcasts/giant-bomb-game-of-the-year-2012-day-four/1600-367/",
      "title" : "Giant Bomb Game of the Year 2012: Day Four"
   },
   {
      "media_link" : "http://www.giantbomb.com/podcasts/download/366/giantbombcast-goty2012-day3-8341.mp3",
      "description" : "We make some hard decisions concerning Skrillex, Nolan North, good-looking games, bad trends, and browser-based games on day three of our 2012 deliberations.",
      "id" : 553,
      "link" : "http://www.giantbomb.com/podcasts/giant-bomb-game-of-the-year-2012-day-three/1600-366/",
      "external_id" : 366,
      "published_at" : "2012-12-26T18:00:00.000Z",
      "title" : "Giant Bomb Game of the Year 2012: Day Three",
      "image" : "http://static.giantbomb.com/uploads/original/0/27/2401026-2400472_2400471_2394941_day1.jpg"
   },
   {
      "id" : 554,
      "description" : "Listen in as we hash out our choices for Walking Dead Episode of the Year, Best Debut, Best Surprise, Miiverse Community of the Year, and Best Use of a Licensed Song.",
      "media_link" : "http://www.giantbomb.com/podcasts/download/365/giantbombcast-goty2012-day2-7815.mp3",
      "title" : "Giant Bomb Game of the Year 2012: Day Two",
      "link" : "http://www.giantbomb.com/podcasts/giant-bomb-game-of-the-year-2012-day-two/1600-365/",
      "external_id" : 365,
      "published_at" : "2012-12-25T18:00:00.000Z",
      "image" : "http://static.giantbomb.com/uploads/original/0/27/2401026-2400472_2400471_2394941_day1.jpg"
   },
   {
      "image" : "http://static.giantbomb.com/uploads/original/0/27/2400472-2400471-2394941_day1.jpg",
      "description" : "We kick things off with our picks for 2012's 2011 Game of the Year, Best Moment/Sequence, Best New Character, Best Music, and Best Classic Revival.",
      "id" : 555,
      "media_link" : "http://www.giantbomb.com/podcasts/download/363/giantbombcast-goty2012-day1-3002.mp3",
      "link" : "http://www.giantbomb.com/podcasts/giant-bomb-game-of-the-year-2012-day-one/1600-363/",
      "published_at" : "2012-12-24T18:00:00.000Z",
      "external_id" : 363,
      "title" : "Giant Bomb Game of the Year 2012: Day One"
   },
   {
      "description" : "Patrick learns first-hand about the karmic repercussions of sports-team trash-talking, Brad gets an iPhone 5, Ryan sees The Hobbit, and we read as many listener emails as we can stand.",
      "media_link" : "http://www.giantbomb.com/podcasts/download/362/giantbombcast-121812.mp3",
      "id" : 556,
      "title" : "Giant Bombcast 12-18-2012",
      "published_at" : "2012-12-18T23:34:00.000Z",
      "external_id" : 362,
      "link" : "http://www.giantbomb.com/podcasts/giant-bombcast-12-18-2012/1600-362/",
      "image" : "http://static.giantbomb.com/uploads/original/0/27/2392475-2392473-screen_shot_2012_12_18_at_3.33.38_pm.png"
   },
   {
      "media_link" : "http://www.giantbomb.com/podcasts/download/360/giantbombcast-121112.mp3",
      "description" : "Now that Brad has finally finished Mass Effect 3, we spend a solid hour going over that trilogy's conclusion, while also discussing FTL, ZombiU, Far Cry 2, 999, Phantom Pain, and more!",
      "id" : 557,
      "external_id" : 360,
      "published_at" : "2012-12-12T01:51:00.000Z",
      "link" : "http://www.giantbomb.com/podcasts/giant-bombcast-12-11-2012/1600-360/",
      "title" : "Giant Bombcast 12-11-2012",
      "image" : "http://static.giantbomb.com/uploads/original/0/27/2387685-2387684-tumblr_m9s3q1mxna1ru2dlxo2_250.jpg"
   },
   {
      "title" : "Giant Bombcast 12-04-2012",
      "link" : "http://www.giantbomb.com/podcasts/giant-bombcast-12-04-2012/1600-359/",
      "published_at" : "2012-12-04T23:02:00.000Z",
      "external_id" : 359,
      "id" : 558,
      "media_link" : "http://www.giantbomb.com/podcasts/download/359/giantbombcast-120412.mp3",
      "description" : "After his two-week absence, Patrick returns to us with harrowing tales of Sports Assholes, while we also tackle topics including The Walking Dead, Far Cry 3, \"the new Wii\", Bungie's Destiny, and the 2012 Levia-thon, going on now at your local Reaper deale",
      "image" : "http://static.giantbomb.com/uploads/original/0/27/2382242-1804812-screen03tcm1918401.jpg"
   },
   {
      "image" : "http://static.giantbomb.com/uploads/original/0/27/2377256-2377253-turkey_carcass1.jpg",
      "description" : "We're back from Thanksgiving break with tales of Funky Barn, Wii U retail experiences, pocket watches, Kickstarter, Assassin's Creed III, Far Cry 3, The Walking Dead, Persona 4, PlanetSide 2, big-ass monitors, and more!",
      "id" : 559,
      "media_link" : "http://www.giantbomb.com/podcasts/download/357/giantbombcast-112712.mp3",
      "title" : "Giant Bombcast 11-27-2012",
      "external_id" : 357,
      "published_at" : "2012-11-28T02:23:00.000Z",
      "link" : "http://www.giantbomb.com/podcasts/giant-bombcast-11-27-2012/1600-357/"
   },
   {
      "image" : "http://static.giantbomb.com/uploads/original/0/27/2372852-2372851-pie_homerun1.gif",
      "link" : "http://www.giantbomb.com/podcasts/giant-bombcast-11-20-2012/1600-356/",
      "published_at" : "2012-11-21T00:29:00.000Z",
      "external_id" : 356,
      "title" : "Giant Bombcast 11-20-2012",
      "id" : 560,
      "description" : "We give thanks for a short work week, Home Run Pies, Assassin's Creed III, Hitman: Absolution, the Wii U launch, the evolution of Mario, PlayStation All-Stars, Mass Effect 3, Starcraft II: Heart of the Swarm, Grand Theft Auto V, and more!",
      "media_link" : "http://www.giantbomb.com/podcasts/download/356/giantbombcast-112012.mp3"
   },
   {
      "description" : "We report in on our first week of Wii U ownership with a scathing treatise on the music of New Super Mario Bros. U, plus we share our latest thoughts on Halo 4, Black Ops II, Curiosity's life-changing secret, and the sexual enigma that is Michael Keaton.",
      "id" : 561,
      "media_link" : "http://www.giantbomb.com/podcasts/download/354/giantbombcast-111312.mp3",
      "title" : "Giant Bombcast 11-13-2012",
      "link" : "http://www.giantbomb.com/podcasts/giant-bombcast-11-13-2012/1600-354/",
      "external_id" : 354,
      "published_at" : "2012-11-13T23:45:00.000Z",
      "image" : "http://static.giantbomb.com/uploads/original/0/27/2367449-2367448-michaelkeaton.jpg"
   },
   {
      "description" : "Ryan and Patrick throw down the Assassin's Creed gauntlet with Brad, Vinny learns the hard way about infant incompatibility with Daylight Savings, Jeff plays a bunch of Halo 4, and more!",
      "media_link" : "http://www.giantbomb.com/podcasts/download/353/giantbombcast-110612a.mp3",
      "id" : 562,
      "external_id" : 353,
      "published_at" : "2012-11-06T22:55:00.000Z",
      "link" : "http://www.giantbomb.com/podcasts/giant-bombcast-11-06-2012/1600-353/",
      "title" : "Giant Bombcast 11-06-2012",
      "image" : "http://static.giantbomb.com/uploads/original/0/27/2361476-2361474-sleep_deprived_mom300x310.jpeg"
   },
   {
      "description" : "We talk Need for Speed: Most Wanted, Assassin's Creed III, The Walking Dead, Dust: An Elysian Tail, Zynga layoffs, and the current state of ethics in game journalism.",
      "id" : 563,
      "media_link" : "http://www.giantbomb.com/podcasts/download/351/giantbombcast-103012.mp3",
      "link" : "http://www.giantbomb.com/podcasts/giant-bombcast-10-30-2012/1600-351/",
      "published_at" : "2012-10-31T05:42:00.000Z",
      "external_id" : 351,
      "title" : "Giant Bombcast 10-30-2012",
      "image" : "http://static.giantbomb.com/uploads/original/0/27/2356256-2356255-596867_ghostbusters2_3.jpeg"
   },
   {
      "image" : "http://static.giantbomb.com/uploads/original/0/27/2350715-2350714-beard_hope.gif",
      "media_link" : "http://www.giantbomb.com/podcasts/download/350/giantbombcast-102312.mp3",
      "id" : 564,
      "description" : "When they're not still going on and on about XCOM, the guys manage to squeeze in some talk about Dance Central 3, Skylanders: Giants, Doom 3 BFG, The Walking Dead, the horrors of Kinect, and more!",
      "link" : "http://www.giantbomb.com/podcasts/giant-bombcast-10-23-2012/1600-350/",
      "external_id" : 350,
      "published_at" : "2012-10-23T22:47:00.000Z",
      "title" : "Giant Bombcast 10-23-2012"
   },
   {
      "image" : "http://static.giantbomb.com/uploads/original/0/27/2345757-2345756-031_cc_lemon_drink.jpeg",
      "title" : "Giant Bombcast 10-16-2012",
      "external_id" : 348,
      "published_at" : "2012-10-17T00:14:00.000Z",
      "link" : "http://www.giantbomb.com/podcasts/giant-bombcast-10-16-2012/1600-348/",
      "media_link" : "http://www.giantbomb.com/podcasts/download/348/giantbombcast-101612.mp3",
      "description" : "With Ryan out of commission, Jeff takes the helm to discuss Brad's Mass Effect 3 deadline, XCOM: Enemy Unknown, Dishonored, Forza Horizon, expired soda, Dance Central 3, couch treasure hunting, Jeff's Internet woes, Halo 4 leaks, and more!",
      "id" : 565
   },
   {
      "id" : 566,
      "description" : "Vinny returns to regale us with the pleasures of air-travel with a six-month old, Brad returns to Albion in Fable: The Journey, Jeff plots out his raid on Tokyo, Patrick chooses his own adventure in Dishonored, and Ryan gets overwhelmed by the alien scour",
      "media_link" : "http://www.giantbomb.com/podcasts/download/347/giantbombcast-100912.mp3",
      "title" : "Giant Bombcast 10-09-2012",
      "external_id" : 347,
      "published_at" : "2012-10-10T03:39:00.000Z",
      "link" : "http://www.giantbomb.com/podcasts/giant-bombcast-10-09-2012/1600-347/",
      "image" : "http://static.giantbomb.com/uploads/original/0/27/2341269-2341268-5182fcc1.jpeg"
   },
   {
      "title" : "Giant Bombcast 10-02-2012",
      "link" : "http://www.giantbomb.com/podcasts/giant-bombcast-10-02-2012/1600-345/",
      "external_id" : 345,
      "published_at" : "2012-10-03T03:11:00.000Z",
      "media_link" : "http://www.giantbomb.com/podcasts/download/345/giantbombcast-100212.mp3",
      "id" : 567,
      "description" : "We download our collective consciousness into Cybertown to air our grievances with Resident Evil 6 and NiGHTS, while also spending an inordinate amount of time discussing the TurboGrafx-16, the Ataris Lynx and Jaguar, Merlin Racing for the Nuon, Elexis Si",
      "image" : "http://static.giantbomb.com/uploads/original/0/27/2337145-2337144-alttp_link1.png"
   },
   {
      "id" : 568,
      "description" : "We talk Halo 4, Hell Yeah, Borderlands 2, Transformers: Fall of Cybertron, Sleeping Dogs, Dead or Alive 5, FTL, Torchlight II, Tokyo Jungle, Far Cry 3, and more!",
      "media_link" : "http://www.giantbomb.com/podcasts/download/344/giantbombcast-092412.mp3",
      "published_at" : "2012-09-26T01:38:00.000Z",
      "external_id" : 344,
      "link" : "http://www.giantbomb.com/podcasts/giant-bombcast-09-24-2012/1600-344/",
      "title" : "Giant Bombcast 09-24-2012",
      "image" : "http://static.giantbomb.com/uploads/original/0/27/2332283-2230715-26668hell_yeahlvl3002.jpg"
   },
   {
      "image" : "http://static.giantbomb.com/uploads/original/0/27/2327311-2327310-saison_sm3.jpeg",
      "title" : "Giant Bombcast 09-18-2012",
      "external_id" : 342,
      "published_at" : "2012-09-19T02:47:00.000Z",
      "link" : "http://www.giantbomb.com/podcasts/giant-bombcast-09-18-2012/1600-342/",
      "description" : "The Giant Bombcast: your home for classic bing bong, Borderlands 2, Torchlight II, Oregon Trail in Space, franchise maths, Wii U, BioWare, and more!",
      "media_link" : "http://www.giantbomb.com/podcasts/download/342/giantbombcast-091812.mp3",
      "id" : 569
   },
   {
      "image" : "http://static.giantbomb.com/uploads/original/0/27/2319944-chinadontcare.jpg",
      "media_link" : "http://www.giantbomb.com/podcasts/download/340/giantbombcast-091112.mp3",
      "id" : 570,
      "description" : "CHINA DON'T CARE.",
      "published_at" : "2012-09-12T03:35:00.000Z",
      "external_id" : 340,
      "link" : "http://www.giantbomb.com/podcasts/giant-bombcast-09-11-2012/1600-340/",
      "title" : "Giant Bombcast 09-11-2012"
   },
   {
      "link" : "http://www.giantbomb.com/podcasts/giant-bombcast-09-04-2012/1600-338/",
      "published_at" : "2012-09-05T02:53:00.000Z",
      "external_id" : 338,
      "title" : "Giant Bombcast 09-04-2012",
      "media_link" : "http://www.giantbomb.com/podcasts/download/338/giantbombcast-090412.mp3",
      "description" : "With PAX Prime 2012 now in our rearview, we try to retrace our steps to figure out where it all went so horribly awesome.",
      "id" : 571,
      "image" : "http://static.giantbomb.com/uploads/original/0/27/2309417-img_0289.jpg"
   },
   {
      "image" : "http://static.giantbomb.com/uploads/original/0/27/2303713-2303712-image7mm1.jpeg",
      "description" : "We prep for PAX with yelling lessons from Sam Kinison, waterbeds, new cars, Rock Band Blitz, Darksiders, Dick's, Guild Wars 2, Nolan North's upcoming Burn Notice spin-off, Nintendo Power, Masocore Mario, and much more!",
      "id" : 572,
      "media_link" : "http://www.giantbomb.com/podcasts/download/336/giantbombcast-082812.mp3",
      "link" : "http://www.giantbomb.com/podcasts/giant-bombcast-08-28-2012/1600-336/",
      "published_at" : "2012-08-28T20:42:00.000Z",
      "external_id" : 336,
      "title" : "Giant Bombcast 08-28-2012"
   },
   {
      "description" : "With Patrick Klepek fresh from his Hawaiian honeymoon we discuss superior BBS software, Sleepy Dawgz, Dust: An Elysian Tail, Pitfall!, Windows 8, Transformers: Fall of Cybertron, Assassin's Creed III, XCOM: Enemy Unknown, OnLive, and more!",
      "media_link" : "http://www.giantbomb.com/podcasts/download/334/giantbombcast-082112.mp3",
      "id" : 573,
      "link" : "http://www.giantbomb.com/podcasts/giant-bombcast-08-21-2012/1600-334/",
      "published_at" : "2012-08-22T02:24:00.000Z",
      "external_id" : 334,
      "title" : "Giant Bombcast 08-21-2012",
      "image" : "http://static.giantbomb.com/uploads/original/0/27/2298778-2298777-mixed_peppercorns_close_up.jpeg"
   },
   {
      "image" : "http://static.giantbomb.com/uploads/original/0/27/2293066-2293065-tumblr_lrhsghmff91qkz2cdo1_500.jpeg",
      "id" : 574,
      "description" : "Brad Shoemaker returns to the fold and we're joined by Will Smith from Tested.com for the latest on Mars, TechNeck, Windows 8, MakerBot, dodgy pronunciations, Darksiders, New Super Mario Bros. 2, LaserDiscs, PokÃ©mon, After Earth, and more on this weekâ€™",
      "media_link" : "http://www.giantbomb.com/podcasts/download/333/giantbombcast-081412.mp3",
      "title" : "Giant Bombcast 08-14-2012",
      "published_at" : "2012-08-14T23:08:00.000Z",
      "external_id" : 333,
      "link" : "http://www.giantbomb.com/podcasts/giant-bombcast-08-14-2012/1600-333/"
   },
   {
      "image" : "http://static.giantbomb.com/uploads/original/0/27/2287540-2287539-beerc265.jpeg",
      "id" : 575,
      "media_link" : "http://www.giantbomb.com/podcasts/download/331/giantbombcast-080712a.mp3",
      "description" : "This week we do battle with dodgy technology to bring you \"Brad Shoemaker\", the triumphant return and immediate retirement of Energy Drink Taste Tests, Iron Brigade for PC, the future of Persona, life after Mass Effect 3, and more! #crackinwise",
      "link" : "http://www.giantbomb.com/podcasts/giant-bombcast-08-07-2012/1600-331/",
      "external_id" : 331,
      "published_at" : "2012-08-07T23:42:00.000Z",
      "title" : "Giant Bombcast 08-07-2012"
   },
   {
      "image" : "http://static.giantbomb.com/uploads/original/0/27/2281248-2281247-f46b6c2ed94811e1a1fa22000a1c00cf_7.jpg",
      "title" : "Giant Bombcast 07-31-2012",
      "published_at" : "2012-08-01T04:11:00.000Z",
      "external_id" : 330,
      "link" : "http://www.giantbomb.com/podcasts/giant-bombcast-07-31-2012/1600-330/",
      "description" : "We discuss the 3DS XL, grinding coins in New Super Mario Bros. 2, Dumbo rides, California Extreme, Snoop Lion, the drunken value of half a hot dog, and more!",
      "id" : 576,
      "media_link" : "http://www.giantbomb.com/podcasts/download/330/giantbombcast-073112.mp3"
   },
   {
      "image" : "http://static.giantbomb.com/uploads/original/0/27/2275262-2275261-300_sparta.jpeg",
      "title" : "Giant Bombcast 07-24-2012",
      "external_id" : 328,
      "published_at" : "2012-07-25T01:40:00.000Z",
      "link" : "http://www.giantbomb.com/podcasts/giant-bombcast-07-24-2012/1600-328/",
      "description" : "It's our 300th podcast! To celebrate this most momentous occasion, we talk aboutâ€¦video games. And other nonsense. You won't want to miss it!",
      "media_link" : "http://www.giantbomb.com/podcasts/download/328/giantbombcast-072412.mp3",
      "id" : 577
   },
   {
      "id" : 578,
      "description" : "We prepare for the end-days with Jim-Bakker-endorsed food buckets, ham radios, suburban crime, chemtrails, hummingbird masks, modem sounds, the Gizmondo, cable TV, the Commodore 128, CPS2 games, Dyad, Olympic sex, and more!",
      "media_link" : "http://www.giantbomb.com/podcasts/download/327/giantbombcast-071712.mp3",
      "title" : "Giant Bombcast 07-17-2012",
      "external_id" : 327,
      "published_at" : "2012-07-17T20:44:00.000Z",
      "link" : "http://www.giantbomb.com/podcasts/giant-bombcast-07-17-2012/1600-327/",
      "image" : "http://static.giantbomb.com/uploads/original/0/27/2268202-2268200-promo_face_5x5_brighter.jpeg"
   },
   {
      "image" : "http://static.giantbomb.com/uploads/original/0/26/2262326-2262325-axfd2vsceaebvua.jpeg",
      "link" : "http://www.giantbomb.com/podcasts/giant-bombcast-07-10-2012/1600-325/",
      "published_at" : "2012-07-11T02:32:00.000Z",
      "external_id" : 325,
      "title" : "Giant Bombcast 07-10-2012",
      "description" : "Let's get a little buzzer going up in here as Drew Scanlon joins us to talk numbers stations, the proper way to operate a HAM radio, The Secret World, Downloads of a Nintendo persuasion, and how to figure out if the computer that's recording your podcast",
      "id" : 579,
      "media_link" : "http://www.giantbomb.com/podcasts/download/325/giantbombcast-071012.mp3"
   },
   {
      "id" : 580,
      "description" : "We prepare for the Molotov cocktail of American holidays with fireworks fantasies, Cisco on Cisco on SisqÃ³, the unexpected legacy of Spec Ops: The Line, One Winged Angel vs. Freebird, the end of Radical, the state of Sega, launch-day server woes, and mor",
      "media_link" : "http://www.giantbomb.com/podcasts/download/324/giantbombcast-070312.mp3",
      "title" : "Giant Bombcast 07-03-2012",
      "published_at" : "2012-07-04T01:18:00.000Z",
      "external_id" : 324,
      "link" : "http://www.giantbomb.com/podcasts/giant-bombcast-07-03-2012/1600-324/",
      "image" : "http://static.giantbomb.com/uploads/original/0/27/2254415-2254414-fantavision_pal_cover.jpeg"
   },
   {
      "id" : 581,
      "description" : "It's like a bucket of confetti for your ears as we talk zombies, Globetrotters, Law &amp; Order, LEGO Batman 2, Quantum Conundrum, Phantasy Star Online 2, The Amazing Spider-Man, Spec Ops: The Line, beer delivery technology, Spencer's Gifts, and more!",
      "media_link" : "http://www.giantbomb.com/podcasts/download/322/giantbombcast-062612.mp3",
      "title" : "Giant Bombcast 06-26-2012",
      "link" : "http://www.giantbomb.com/podcasts/giant-bombcast-06-26-2012/1600-322/",
      "published_at" : "2012-06-27T00:23:00.000Z",
      "external_id" : 322,
      "image" : "http://static.giantbomb.com/uploads/original/0/27/2246527-2246526-0.jpg"
   },
   {
      "image" : "http://static.giantbomb.com/uploads/original/0/27/2240933-2240932-passwor_scan_01.jpeg",
      "title" : "Giant Bombcast 06-19-2012",
